,Name,Description,Also known as,Scientific name,Substitutions
102,cayenne pepper - fresh,"These are often used in Cajun recipes.  Green cayennes appear in the summer, while hotter red cayennes come out in the fall. They are very hot.","bird pepper, finger chili, ginnie pepper",Capsicum annuum,"['chile de árbol dried', 'Thai chili pepper - fresh', 'habanero - fresh', 'jalapeno pepper ', 'Serrano pepper  ', 'cascabel pepper - dried', 'pequin pepper dried', 'tepin dried', 'Holland chili', 'cherry pepper']"
103,cayenne pepper dried,"These are very hot, bright red chilies. Recipes that call for cayenne pepper are likely referring to a ground powder that goes by the same name, or possibly to the fresh version of the pepper.",Ginnie pepper,Capsicum annuum,"['chile de árbol dried', 'guajillo chili ']"
104,Cerignola olives,These sweet Italian olives are large enough to stuff. Black Cerignolas are softer than green Cerignolas.,Bella di Cerignola,Olea europaea,"['Lucque olives', 'Picholine olives']"
105,Charantais melon,This is reputed to be one of the best melon varieties of all.,French Charantais melon,"Cucumis melo, cantalupensis","['honeydew melon', 'cantaloupe']"
106,chayote,"This mild-flavored squash looks like a wrinkled, pale green pear.  It needs to be cooked before serving, and for a longer time than other summer squash.  You should peel a chayote before cooking it, but don't take the seed out--it's edible and tasty.  Cooked chayotes make good low-fat substitutes for avocados.","cho-cho, chocho, choko, christophene, christophine, chuchu, custard marrow, mango squash, mirliton (in the South), pear squash, pepinella, pepinello, sousous, vegetable pear, xoxo, xuxu",Sechium edule,"['zucchini', 'kohlrabi', 'summer squash', 'carrot', 'bell pepper']"
107,cherimoya,"This South American tropical fruit is shaped like a pine cone and has a gray-green, scaly skin. The soft white pulp inside has large black (inedible) seeds and tastes like a creamy blend of tropical flavors. Hard cherimoyas should be stored at room temperature until they give a little when squeezed, then they should be refrigerated until they're ready to serve.","chirimoya, custard apple, pawpaw (incorrectly)",,"['atemoya', 'sweetsop', 'pineapple']"
108,cherry,"There are three main categories of cherries:  sweet cherries, which are for eating out of hand, sour cherries, which are best suited for making pies, preserves, and sauces, and tart chokecherries.",,Prunus avium,['Stone Fruit']
109,cherry pepper,"Along with pepperoncini, this is a good pickling pepper. They are moderately hot, and range in color from orange to bright red.","bird cherry pepper, cherry bell pepper, cherry chile, cherry chili, Creole cherry pepper, hot cherry pepper, Hungarian cherry pepper, pimiento pepper, wiri-wiri",,"['cayenne pepper - fresh', 'pepperoncini']"
110,cherry tomato,"These are less than an inch in diameter, perfect for adding to salads or crudité platters, or grilling on skewers.  There are both red and yellow varieties.",,"Solanum lycopersicum, cerasiforme","['teardrop tomato', 'slicing tomato']"
111,chilaca pepper,"When dried, a chilaca pepper is called a pasilla chile. They are mild.",chile chilaca,Capsicum annuum,"['poblano pepper ', 'pasilla chili']"
112,Chilcostle chili,"This hard-to-find and moderately hot Mexican chili is used in soups, stews, tamales, and mole sauces. It imparts a yellowish color to dishes.",chile chilcosle,Capsicum annuum,[]
113,chile de árbol dried,"Unlike many chilies, these remain bright red even after drying, so they're a favorite for making chili wreaths. They're very hot and somewhat acidic. Don't confuse the dried version with the fresh or powdered versions, which go by the same name.","arbol chile, bird's beak chili, chile árbol, rat's tail chili, red chile","Capsicum annuum, De Árbol","['cayenne pepper dried', 'pequin pepper dried']"
114,Chilhuacle negro chile,This excellent Mexican chili is loaded with flavor but hard to find. It's used to make mole negro and bean dishes. It is moderately hot.,,Capsicum annuum,[]
115,Chinese dates (dried),"When fresh, these fruits are crisp like apples and have a mild, sweet flavor. In the United States, they're most often available dried. Chinese are different than middle eastern palm dates.","Chinese jujube (dried), Chinese red date, jujube (dried), red date, senjed",Ziziphus jujuba,"['dates', 'dried apple', 'prune', 'raisins']"
116,Chinese dates (fresh),"These are usually dried, but you can sometimes find fresh dates in late summer and fall. When you get them home, let them ripen on the counter for awhile until they become soft and sweet. Chinese are different than middle eastern palm dates.",jujube,Ziziphus jujuba,"['apple', 'prune']"
117,Chinese eggplant,"Compared to the familiar American eggplant, Chinese eggplants have thinner skins, a more delicate flavor, and not as many of the seeds that tend to make eggplants bitter.",qiézi,Solanum melongena,"['Japanese eggplant', 'Italian eggplant']"
118,chipotle negro chile,"These are darker, milder versions of the chipotle chile.","black chipotle, chipotle mora, mora, red-black chipotle",,['chipotle pepper ']
119,chipotle pepper ,"These dried and smoked jalapeño peppers lend a wonderful, complex flavor to sauces. They're usually rehydrated and canned in adobo sauce, but you can also buy them dried in cellophane bags. They are medium hot.","chile seco, jalapeno pepper dried, meco, smoked jalapeno pepper","Capsicum annuum, jalapeño","['jalapeno pepper ', 'morita pepper', 'mora chili', 'ancho chili']"
120,chokecherry,"These are too tart for most people to eat out of hand, but they make delicious preserves.","bitter-berry, Virginia bird cherry",Prunus virginiana,"['sour cherry', 'cranberry']"
121,citron,"This resembles a large, bumpy lemon. Its thick rind is used to make marmalade, and its zest is a close substitute to lemon zest.","cedro, yuzu",Citrus medica,['lemon']
122,clam juice,,clam nectar,,"['fish broth', 'water']"
123,cloudberry,Both the color and flavor of these Scandinavian berries pale in comparison to the raspberry.,"averin, bakeapple, knotberry, low-bush salmonberry, nordic berry",Rubus chamaemorus,['raspberry']
124,cloudberry preserves,These preserves are sweet and somewhat mild. Look for them in Scandinavian markets.,,Rubus chamaemorus,"['loganberry jam', 'gooseberry preserves']"
125,coconut,"The most common form of coconut in markets is the dry coconut, with a hard brown shell surrounding firm coconut meat with liquid in the center.  Green coconuts = water coconuts are young coconuts with very soft meat inside.  They're more often found in the tropics.   Select coconuts that are free of cracks or mold, that are heavy for their size, and that have lots of water in them when you shake them.  To crack one, hit it along its equator with a blunt instrument, pouring off the water when the first crack appears.",,Cocos nucifera,"['Brazil nut', 'macadamia nut']"
126,coconut juice,,nam katee,Cocos nucifera,['water']
127,Comice pear,"These juicy pears are considered to be the best for eating out of hand, but they're very expensive.",,Pyrus communis,"['Anjou pear', 'Bartlett pear', 'Asian pear']"
128,Concord grapes,These dark purple grapes have large seeds. They are tangy and sweet. It is often used to make grape jelly.,,Vitis labrusca,['flame seedless grapes']
129,Cortland apple,"These are all-purpose apples. Since their flesh is slow to brown after it's cut, Cortland apples are especially good in salads. If substituting another variety in a salad, dip it in acidulated water first to keep it from darkening.",,Malus domestica,"['Braeburn apple', 'Fuji apple', 'honeycrisp apples', 'Jonathan apple']"
130,Costeño Amarillo,"This yellow Mexican chili is used to make soups, stews, and mole sauces. It's fruity and moderately hot and somewhat hard to find.","bandeño, chile costeño, Costeno amarillo ",Capsicum annuum,['guajillo chili ']
131,Cotton Candy™ grapes,These are sweet seedless white table grapes. Some think they taste like cotton candy.,,,"['Thompson seedless grapes', 'flame seedless grapes']"
132,cousa squash,"This Middle-Eastern summer squash looks a lot like spaghetti squash, only it has a thin, edible skin. It's similar to zucchini, but its larger size makes it a natural for stuffing.","couza squash, kousa",,['zucchini']
133,crab apple,"These small apples are too tart to eat raw, but they're loaded with pectin and make great jams and jellies.","crabapple, crabtrees, wild apples",Malus sylvestris,['quince']
134,cracked Provencal,These aromatic  green olives are marinated in a solution with herbes de Provence.,cracked Provençal,Olea europaea,[]
135,cranberry,"These tart berries are traditionally used to makes sauces and garnishes for Thanksgiving and Christmas dinners.  It's best to buy them at their peak in October and November, and freeze any that you don't use right away.",bounceberry,Vaccinium macrocarpon,"['lingonberry', 'carissa', 'rhubarb']"
136,cranberry juice,See the recipe for Cranberry Juice posted by Veggies Unite!,,Vaccinium macrocarpon,"['grape juice', 'pineapple juice', 'pomegranate juice']"
137,cranberry sauce,"This is a classic accompaniment to Thanksgiving and Christmas dinners. It's made of cranberries that have been cooked with sugar and other flavorings, like orange zest, ginger, port, or maple syrup.",,Vaccinium macrocarpon,[]
138,Crane melon,"This melon-cantaloupe cross is exceptionally juicy and flavorful, but it's hard to find outside of Sonoma County, California.",,"Cucumis melo, Oliver Crane",['cantaloupe']
139,Cranshaw melon,"This large, popular melon is a cross between the Persian and Casaba melons. The rinds come in two colors: yellow and creamy white. The yellow ones taste better. You can buy Cranshaws while they're still a little underripe and let them sit on the counter for a few days. When fully ripe, a Cranshaw will be fragrant and yield slightly to gentle pressure at its blossom end. They're best in the fall.",Crenshaw melon,Cucumis melo,"['casaba melon', 'Persian melon', 'Sharlyn melon', 'Spanish melon', 'cantaloupe', 'honeydew melon']"
140,crimson seedless grapes,This is a common red seedless grape.,,Vitis vinifera,"['flame seedless grapes', 'Thompson seedless grapes']"
141,Criterion apple,"This is a good apple for eating out of hand, or for making applesauce or pies. Its flesh is slow to brown after it's cut.",,Malus domestica,[]
142,crystallized ginger,"This is fresh ginger that has been cooked in a sugar solution and then coated with sugar. It's similar to candied ginger, and the two are often used interchangeably.",candied ginger,,"['candied ginger', 'sugar', 'ginger root', 'nuts']"
143,cuaresmeno - fresh,They are moderately hot.,,,"['jalapeno pepper ', 'Serrano pepper  ']"
144,cubanelle,"These sweet, mild peppers are usually sold while yellowish-green. They become hotter and redder as they mature.","Cuban pepper, cubanelle pepper, Friarelli, Green cubanelle, Italian frying pepper",Capsicum annuum,['bell pepper']
145,cucuzza,,"bottle gourd, calabash, cucuzzi, Italian squash, New Guinea bean, suzza melon, Tasmania bean, zucca",Lagenaria siceraria,"['zucchini', 'yellow squash']"
146,cupuacu,The cupuacu fruit grow on medium sized trees native to the Amazon basin. The fruit is brown skinned with a white pulpy center. Cupuacu has a fruity chocolatey flavor.,"copoazu, cupuaçu",Theobroma grandiflorum,[]
147,currant,"These berries are too tart for most people to eat out of hand, but they make terrific preserves and garnishes.   They come in three colors:  red, white, and black. If color's not important, you can use them interchangeably in most recipes, though red and white currants aren't as tart as black.  Don't confuse these berries with the dried fruit of the same name that looks like a small raisin.  You can sometimes find fresh currants in specialty produce markets in the summer.  If not, frozen currants are a good substitute.",,Ribes,"['gooseberry', 'raspberry']"
148,currant tomato,These are about half the size of cherry tomatoes.,pimp,Solanum pimpinellifolium,"['cherry tomato', 'teardrop tomato', 'grape tomato']"
149,currants,These dried Zante grapes look like tiny raisins. Don't confuse them with the fresh sour berry that also called a currant.,"dried Corinth grapes, dried currants, Zante currants, Zante raisins",Ribes,"['raisins', 'golden raisin']"
150,dates,"These are rich in flavor, nutrients, and calories. Medjool dates are richer and meatier than the other Deglet Noor dates. Other varieties include Khalas, sukkary, barhi, medjool, ajwa and kimia.If you plan to chop them, look for cooking dates, date pieces, or pressed dates--they're a lot cheaper than the exquisite dessert dates that are intended to be eaten whole. Don't confuse dates with fresh dates, which are hard to find in supermarkets.To learn about different varieties of dates, click here.",dried date,Phoenix dactylifera,"['dried fig', 'raisins', 'dates (fresh)']"
151,dates (fresh),"Fresh dates are sometimes available at farmer's markets in the late summer.  They're crunchy, and not as sweet as dried dates.",,Phoenix dactylifera,"['barhi dates (fresh)', 'dates']"
152,deglet noor dates,These honey sweet translucent deglet noor dates are enjoyed in North Africa. They originated in Algeria.,deglet nour,Phoenix dactylifera,"['dates', 'raisins', 'dried fig']"
153,delicata squash,"This is one of the tastier winter squashes, with creamy pulp that tastes a bit like sweet potatoes.  Choose squash that are heavy for their size.","Bohemian squash, sweet potato squash",Cucurbita pepo,"['butternut squash', 'buttercup squash', 'sweet potato']"
154,dewberry,"These are similar to blackberries, only they're smaller.",,Rubus aboriginum,"['youngberry', 'blackberry', 'raspberry', 'loganberry', 'boysenberry', 'olallieberry']"
155,donut peach,"These squat peaches have white flesh, and a very good flavor.  Use them as you would ordinary peaches.","flat peach, Saturn peach","Prunus persica, platycarpa",['peach']
156,dragon fruit,"This comes from a cactus native to Central and South America, and has a mild flavor. To eat it, either peel it or cut it in half and scoop out the white, polka-dotted pulp with a spoon.Select dragon fruit by pressing it gently. It should give just a little.","pitahaya, pitaya, strawberry pear",,"['kiwi fruit', 'mangosteen']"
157,dried apple,These are popular additions to trail mixes. They're often treated with sulfur to improve their color and shelf life.,,Malus domestica,['dried pear']
158,dried apricot,Turkish dried apricots are lighter in color and milder in flavor than other varieties. They're often treated with sulfur to improve their color and shelf life.,,Prunus armeniaca,"['dried peach', 'dried nectarines', 'sun-dried tomatoes']"
159,dried apricot paste,"People in the Middle East usually make a drink out of this fruit leather by putting it into boiling water.  During Ramadan, it's often served before and after the day-long fast.  Look for it in Middle Eastern markets.","ameerdine, qamar el-deen",Prunus armeniaca,[]
160,dried banana,"These usually come in two forms: long spears, which are very sweet and best for cooking, and chips, which are fried in oil, crunchy, and best suited for trail mixes.",dried banana,"Musa acuminata, cavendish",['Dried Fruit']
161,dried cantaloupe,These are very sweet and have an intense cantaloupe flavor.,,"Cucumis melo, cantalupensis",['dried papaya']
162,dried carrots,These are used to make muffins and cakes.,dried grated carrots,Daucus carota,[]
163,dried cherry,"These are large and sweet, and they can serve as a refreshing alternative to raisins in many recipes.",,Prunus avium,"['dried cranberries', 'raisins', 'dried apricot', 'currants']"
164,dried citrus peel,"Begin with orange, lemon, tangerine, or grapefruit peels, scrape off and discard as much of the bitter white pith as possible, and dry what's left in the sun until hard",dried fruit peel,,['lemon zest']
165,dried cranberries,"With their flashy color and tangy flavor, dried cranberries are a good alternative to raisins in many recipes. Craisins is a well-known brand.",Craisins®,Vaccinium macrocarpon,"['raisins', 'dried cherry', 'currants']"
166,dried eggplant,Look for these in Middle Eastern markets.,,Solanum melongena,[]
167,dried fig,"These are a great source of fiber and calcium. Varieties include the Black Mission fig, which is a good choice for eating out of hand, and the Calimyrna = Turkish = Smyrna fig, which is best for cooking. If your figs become too dry, you can rehydrate them with water. Don't eat the stems. ","black mission fig, Calimyrna fig, green fig, Smyrna fig, Turkish fig",Ficus carica,"['raisins', 'prune']"
168,Dried Fruit,"Dried fruit is a terrific snack, but cooks also use it in everything from muffins to stews.  Drying has the obvious advantage of letting us enjoy our favorite fruit when it's out of season, but it also serves to concentrate the fruit's flavor and sugar.  Since high concentrations of sugar ward off bacteria, dried fruit can last up to a year without refrigeration.   If you live in a hot, dry climate, you can dry fruit just by leaving it out in the sun for a few days.  If not, you can use an oven or dehydrator.  Sulfur dioxide is sometimes added to the fruit to improve its shelf life and color.  If you're allergic to it, you can usually find unsulfured dried fruit at health food stores.  In a pinch, you can remove some of the sulfur by boiling treated dried fruit for a minute or so, then draining off the liquid.",,,['nuts']
169,dried mango,These are sometimes coated with sugar.,,Mangifera,['dried papaya']
170,dried mulberries,"These are the size of large raisins, and they taste like very dry figs. Look for them in Middle Eastern markets.",toot,Morus,[]
171,dried nectarines,"These are similar to dried peaches, but often a bit more expensive. They're often treated with sulfur.",,"Prunus persica, nucipersica","['dried peach', 'dried apricot']"
172,dried papaya,These are sometimes coated with sugar.,,Carica papaya,"['dried cantaloupe', 'dried mango']"
173,dried peach,"These are similar to dried apricots, only larger and milder. They're often treated with sulfur.",,Prunus persica,"['dried nectarines', 'dried apricot']"
174,dried pear,These don't have the cloying sweetness of some dried fruits. They're often gassed with sulfur dioxide in the drying process in order to improve their color and shelf life.,,Pyrus,['dried apple']
175,dried persimmon,"These often have a white, sugary residue, which is edible.",,Diospyros,['Dried Fruit']
176,dried pineapple,These are sometimes coated with sugar.,,Ananas comosus,"['dried papaya', 'dried mango']"
177,dried strawberries,"These are sweet and chewy, and they're great in trail mixes or granola.",,Fragaria ananassa,['dried cherry']
178,duku,"Duku fruit are round, tan and 1 to 2 inches in diameter. The hard shell surrounds a soft fleshy sweet and tart thick flesh. They grow in clusters.","langsat, langsat Hutan, longkong, meliaceae, wollongong",Lansium domesticum,"['grapes', 'litchi']"
179,durian,"The weird and smelly durian has attracted a cult-like following. It's called the King of Fruits by aficionados in Southeast Asia, but Westerners usually don't care much for its mild oniony flavor. Once cut open, the durian eventually gives off such a strong and foul odor that it's banned on Singaporean subways. Look for it in Asian markets. The boiled seeds of the durian are called betons.",stinky fruit,Durio,[]
180,Eggplants,"This is a spongy, mild-tasting vegetable that's meaty yet low in calories. It's never eaten raw, but it can be baked, grilled, or sautéed. The best eggplants are shiny, firm (but not too hard), and heavy for their size, with bright green stems and unbroken skin. Smaller eggplants tend to have fewer bitter seeds, as do ""male"" ones with round scars at their blossom (non-stem) end. (The scars on ""female"" eggplants look like dashes.) Freshness is important, so don't store eggplants for very long.","aubergine, berenjena, brinjal, egg apple, garden egg, Guinea squash, melanzane, melongene, patlican",Solanum melongena,"['zucchini', 'okra', 'portobello mushroom']"
181,elderberry,"These are too tart for most people to eat out of hand, but they make terrific preserves and wine.",,Sambucus,"['black currant', 'cranberry']"
182,Elstar apple,This firm apple is especially good for making applesauce.,,Malus domestica,[]
183,empeltre olives,These Spanish black olives are soaked in sherry.,,Olea europaea,[]
184,Empire apple,This is a Red Delicious-McIntosh cross that's great for baking or eating out of hand.,,Malus domestica,[]
185,English cucumber,"This foot-long slicing cucumber is pricier and less flavorful than other varieties, but it has less conspicuous seeds, a thinner skin, and a plastic wrapper--instead of a wax coating--to improve shelf life.  All of this saves preparation time, since there's no need to peel or seed the cucumber before slicing it.  This is a good variety if you focused on looks--you can cut it into round, green trimmed slices.","burpless cucumber, English cucumber, European cucumber, gourmet cucumber, greenhouse cucumber, hothouse cucumber, seedless cucumber",,"['Japanese cucumber', 'garden cucumber']"
186,Enterprise apple,,,Malus domestica,[]
187,feijoa,"To eat feijoas, just cut them in half and scoop out the pulp with a spoon.  They also make terrific preserves and syrups.  Look for them in large supermarkets.  If they're hard when you buy them, allow them to ripen at room temperature until they give a bit when you squeeze them, then store them in the refrigerator.","feijoda, pineapple guava",,"['kiwi fruit', 'pineapple', 'strawberry', 'guava']"
188,fig,"Varieties include Calimyrna = Smyrna and Kadota, both with green skin and pinkish-white flesh, and the most popular variety, and the Mission fig = black Mission fig, with dark purple skin and pink flesh.  Dried figs are not good substitutes for fresh.","black Mission fig, Calimyrna, Kadota, Mission fig, Smyrna",Ficus carica,['pear']
189,fig preserves,,,Ficus carica,['kumquats in syrup']
190,Filipino eggplant,,,Solanum melongena,[]
191,flame seedless grapes,These are common and popular red seedless grapes.,,Vitis vinifera,"['Thompson seedless grapes', 'crimson seedless grapes']"
192,fraises des bois,"These small, wild strawberries are either white or red, and have a very intense flavor.","alpine strawberries, Carpathian strawberries, fraises de bois, fraises des bois (plural), wild strawberries, wood strawberries",Fragaria vesca,['strawberry']
193,French butter pear,,,Pyrus communis,[]
194,Fresno pepper,"These are similar to jalapeno peppers, but with thinner walls. They're great in salsas. Green Fresnos are available in the summer. the hotter red ones come out in the fall.","Fresno chile pepper, Fresno chili pepper",,"['jalapeno pepper ', 'Serrano pepper  ']"
195,Fuerte avocado,"This is in season from late fall through spring.  It's not quite as buttery as the Hass avocado, but its flavor is excellent.",Florida avocado,Persea americana,"['avocado', 'chayote', 'fresh peas', 'asparagus', 'broccoli', 'artichoke hearts']"
196,Fuji apple,"This variety is good for eating out of hand, or for making applesauce or pies.",,Malus domestica,"['Gala apple', 'Golden Delicious apple']"
197,fuzzy melon,This sweet and mild squash has a fuzzy feel to it.,"Chi qua, fuzzy gourd, hairy cucumber, hairy melon, moqua, wax gourd","Benincasa hispida, chieh-qua",['zucchini']
198,Gaeta olives,"These are small, purple Italian olives are either dry-cured (making them black and wrinkled) or brine-cured (making them dark purple and smooth-skinned).",Gyeta olive,,['Kalamata olives']
199,Gala apple,This apple is outstanding for eating out of hand or for baking or making applesauce.,,Malus domestica,"['Fuji apple', 'Golden Delicious apple', 'Granny Smith apple', 'honeycrisp apples']"
200,Galia melon,"This sweet, juicy melon is a honeydew-cantaloupe cross.  Its biggest drawback is its relatively high price.",sarda,"Cucumis melo, reticulatus","['honeydew melon', 'cantaloupe']"
201,garden cucumber,"You can find these throughout the year at all but the most poorly stocked markets.  The ones you find in supermarkets are usually waxed to hold in moisture and improve shelf-life--these should be peeled or at least scrubbed well before serving.  Unwaxed cucumbers don't need to be peeled, but better cooks often do so since the peels tend to be thick and bitter.  It's also a good idea to remove the seeds from these kinds of cucumbers; just cut them in half lengthwise and scrape them out.   Select cukes that are firm, dark green, and rounded at the tips.","field-grown cucumbers, market cucumber, outdoor cucumber, regular cucumber",,"['English cucumber', 'Japanese cucumber', 'Armenian cucumber', 'lemon cucumber']"
202,garden eggs,"These are tiny eggplants, the size of an egg or smaller. Their color ranges from white to greenish-yellow.",,Solanum melongena,[]
203,gherkin cucumber,"These small, bumpy greed cucumbers are used to make Gherkin pickles or, if pickled while still small, cornichon pickles.",,,[]
204,ghost pepper,"Ghost peppers are a very hot (over 1,000,000 scovilles) hybrid between Capsicum chinese and Capsicum frutescens. It is grown and used in northern India.","bhut jolokia, king chili, king cobra chili, Tezpur chili",Capsicum chinese,"['habanero - fresh', 'Scotch bonnet chili']"
205,ginger jam,Look for this in Asian grocery stores.,,,['candied ginger']
206,glace cherries,"red, green and yellow versions.",glacé cherries,,"['dried cherry', 'dried cranberries']"
207,globe squash,"You can stuff these and bake them, or slice and sauté them.",Ronde de Nice,,['zucchini']
208,Golden Delicious apple,"This sweet apple is good for eating out of hand, baking, and for making pies. The yellower the better.",,Malus domestica,"['Fuji apple', 'honeycrisp apples', 'Gala apple']"
