,Name,Description,Also known as,Scientific name,Substitutions
209,golden delicious squash,This is an orange-red variety of Hubbard squash,,Cucurbita maxima,['Hubbard squash']
210,golden nugget squash,"This has a pleasant flavor, but it doesn't have as much flesh as other squashes and the heavy rind makes it hard to cut before cooking.   Select specimens that are heavy for their size, and that have a dull finish.  Those with shiny rinds were probably picked too young, and won't be as sweet.",oriental pumpkin,Cucurbita maxima,['acorn squash']
211,golden raisin,These are more tart than ordinary raisins.,Sultana,Vitis vinifera,"['raisins', 'muscat raisins', 'currants', 'dried apricot']"
212,golden raspberry,"This is a blonder, milder version of the red raspberry. Don't confuse it with the Golden Raspberries (Razzies), which are given out to honor each year's worst films and performers.",,Rubus,['raspberry']
213,gooseberry,"These large, tart berries are in season only in June and July, but canned gooseberries work well in pies and fools.  American gooseberries are round and about 1/2 inch in diameter, while European gooseberries are oblong, and about twice the size of American gooseberries.  They're very acidic, and so they're great with roasted meats, like goose.  The freshest gooseberries are covered with fuzz.",,Ribes missouriense,"['rhubarb', 'kiwi fruit', 'currants']"
214,gooseberry preserves,,,,"['cloudberry preserves', 'loganberry jam', 'strawberry preserves']"
215,Granny Smith apple,"This is a firm, tart apple that's good for baking, making pies, and eating out of hand. They tend to have thick skins, so you might want to peel them before serving.",,Malus domestica,['quince']
216,grape jelly,,,Vitis vinifera,"['muscadine jelly', 'red currant jelly']"
217,grape juice,"This category includes red grape juice, white grape juice, and sparkling grape juice.","red grape juice, sparkling grape juice, white grape juice",Vitis vinifera,['wine']
218,grape tomato,,,Solanum lycopersicum,"['teardrop tomato', 'currant tomato', 'cherry tomato']"
219,grapefruit,"A grapefruit is a large, slightly tart kind of citrus fruit. The rind is yellow, though often tinged with green or red. Grapefruits are categorized by the color of their pulp: red, pink, or ""white"" (actually honey-colored). The color of the pulp doesn't affect the flavor. When buying grapefruit, select specimens that are smaller, thin-skinned, and heavy for their size. Some varieties are seedless. They're best in the winter and spring.",,Citrus paradisi,"['ugli fruit', 'pomelo', 'tangelo']"
220,grapefruit juice,This comes either sweetened or unsweetened.,,Citrus paradisi,"['orange juice', 'pineapple juice']"
221,grapes,"Many varieties of grapes are turned into wine, vinegar, jelly, and raisins, but table grapes are for eating out of hand.  They're classified by their color--red, green, and blue--and by whether they have seeds or not.  Seedless varieties are popular because they're easy to eat, but often the seeded varieties offer more flavor and better value.",table grapes,Vitis vinifera,"['kiwi fruit', 'blueberry']"
222,grated coconut,"Bags of grated coconuts are usually stored among the baking supplies in larger markets. Varieties include dried or desiccated coconut, flaked, angel flake, moist, sweetened and unsweetened, toasted and untoasted, and macaroon coconut.To make your own: To grate, peel off the brown skin, then grate the white flesh with a grater, food processor, or vegetable peeler. To toast, spread unsweetened grated coconut on a baking sheet and bake in a 350°F oven until coconut is golden (about 5 minutes).","coconut meat, desiccated (more finely ground), dried coconut, flaked coconut, grated coconut, shredded coconut",Cocos nucifera,['nuts']
223,Gravenstein apple,"This is a good, all-purpose apple, but it's best suited for making applesauce and pies.",,Malus domestica,"['Braeburn apple', 'Gala apple']"
224,Greek black olives,"A generic black Greek olive is large, dark purple and brine-cured. Popular varieties include Kalamata, Amphissa, and Royal.",,Olea europaea,[]
225,Greek green olives,Napfilion and Ionian olives are the most common types of green Greek olives.,,Olea europaea,['Nafplion green olives']
226,green almonds,Middle Eastern cooks use these in stews and desserts.,,Prunus dulcis,[]
227,green chile canned,,,,"['Anaheim chili', 'poblano pepper ']"
228,green goddess eggplant,This has a very mild flavor.,,Solanum melongena,[]
229,green olives,"Green olives are picked from the tree before they're completely ripened. The most common variety is the Manzanilla olive, which is often pitted and stuffed. Other green olives varieties include the Agrinion, Arauco, Arbequina, Atalanta, green Cerignola, cracked Provençal, Kura, Lucque, Nafplion, Picholine, Sevillano, and Sicilian.",,Olea europaea,"['black olives', 'caper berry', 'cocktail onion']"
230,green papaya,Southeast Asian cooks like to shred these into salads.,cooking papaya,Carica papaya,['chayote']
231,green tomato,These are picked before they turn red. Southerners like to fry them.,,Solanum lycopersicum,"['tomatillo', 'slicing tomato', 'bell pepper']"
232,guajillo chili ,"One of the more popular Mexican chilies, the guajillo (or dried mirasol chili) has a fruity flavor and medium heat (Scoville heat scale of 2,500 to 5,000 SHU). It's smooth, shiny, and reddish-brown, and it has a tough skin, so it needs to be soaked longer than other chiles.These are commonly used for marinades and adobos.","chile Guajillo, dried mirasol chile",Capsicum annuum,"['ancho chili', 'New Mexico red chili', 'pasilla chili', 'cascabel pepper - dried', 'mirasol pepper ', 'California chili ']"
233,guava,"These bruise easily, so markets usually sell them while they're still hard and green. Allow them to ripen at room temperature until they become yellow and very aromatic, then either eat or refrigerate them. The peel and seeds can be eaten along with the juicy pulp, but some people remove them.","goyave, guayaba, guyava",,"['pineapple', 'strawberry']"
234,guero pepper,These are moderately hot.,"caloro, caribe, chile guero, goldspike, Sante Fe grande, yellow hot chile",,"['jalapeno pepper ', 'Fresno pepper', 'Serrano pepper  ']"
235,habanero - dried,"Don't confuse dried habaneros with the fresh version, which goes by the same name. These extremely hot chiles are wrinkled and orange.","habañero chili, habañero pepper","Capsicum chinense, habanero",['chile de árbol dried']
236,habanero - fresh,These extremely hot orange chiles have a fruity flavor. They're best in the summertime.,habanero pepper,"Capsicum chinense, habanero","['Scotch bonnet chili', 'manzana chili', 'cayenne pepper - fresh', 'jalapeno pepper ', 'Serrano pepper  ']"
237,halawi dates,These amber-colored sweet chewy halawi dates are grown extensively in Iraq.,,Phoenix dactylifera,"['dates', 'raisins']"
238,Hass avocado,"This is available year-round and has a rich flavor and creamy texture. The skin turns almost black when the avocado is ripe, which can camouflage bad bruises. This is the best variety by far for guacamole, but it turns a bit mushy in salads.",California avocado,Persea americana,"['avocado', 'chayote', 'fresh peas', 'asparagus', 'broccoli', 'artichoke hearts']"
239,Hawaiian eggplant,,,Solanum melongena,[]
240,Holland bell pepper,"These are like bell peppers, only they're sweeter and have thicker walls. They come in different colors.",,Capsicum annuum,['bell pepper']
241,Holland chili,These are hot.,Dutch chile,,"['cayenne pepper - fresh', 'Fresno pepper']"
242,Holland eggplant,,,Solanum melongena,"['Italian eggplant', 'Chinese eggplant', 'zucchini', 'Eggplants']"
243,Hondroelia olives,"This is a juicy, meaty olive.",,Olea europaea,[]
244,honeyball melon,"This is just like a honeydew melon, only it's smaller, rounder, and covered with netting.","green melon, honey ball melon",Cucumis melo,"['honeydew melon', 'cantaloupe']"
245,honeycrisp apples,,,Malus domestica,"['Fuji apple', 'Golden Delicious apple', 'Braeburn apple']"
246,honeydew melon,"These large, choice melons have either green or orange flesh. As honeydews ripen, they turn from green to creamy white to yellow. Avoid green ones, but a creamy white one will (unlike other melons) ripen on your counter in a few days. A perfectly ripe honeydew will yield just a bit to pressure at the blossom end and have a sticky, velvety rind.","green melon, honey dew melon",Cucumis melo,"['cantaloupe', 'Cranshaw melon']"
247,hontaka pepper - fresh,,,,[]
248,Hubbard squash,"This variety has tasty flesh, but it's too large for many families to handle and the rind is hard to cut though. Some grocers cut them into smaller pieces before putting them out.",,Cucurbita maxima,"['pumpkin', 'golden delicious squash', 'buttercup squash', 'butternut squash', 'banana squash', 'green papaya']"
249,huckleberry,"These are similar to blueberries, and they're great for making preserves and syrups.  Some specialty markets carry them in the summer.",,Vaccinium parvifolium,"['blueberry', 'bilberry']"
250,ilama,Ilama are hard to find outside of Mexico or Guatamala. There are two types of Ilama fruit; white and pink.,illama,Annona macroprophyllata,"['sweetsop', 'cherimoya']"
251,Indian bitter melon,"This is fairly bitter. Choose melons that are bright green. They turn tough and yellow as they age. You can eat the peels and seeds, or scrape out the seeds to reduce the bitterness.","balsam pear, bitter apple, bitter melon, bitter squash, Indian bitter gourd, karela",Momordica charantia,['bitter melon']
252,Indian eggplant,,baby eggplant,Solanum melongena,['Japanese eggplant']
253,Italian eggplant,"These are smaller than American eggplants, but they're otherwise very similar.",,Solanum melongena,['American eggplant']
254,jaboticaba,"These resemble large, dark purple grapes, and they're very popular in Brazil. You can eat them like grapes, though you'll have to contend with thick, tart skins. You can also make delicious jams, jellies, and wines from them.",,Plinia cauliflora,['grapes']
255,jabuticaba,Jabuticaba fruit is grape like about 1 to 2 inches in diameter. Under the thick skin is the sweet pink or white flesh.,"guaperu, jaboticaba",Myrciaria cauliflora,"['muscadine grapes', 'grapes']"
256,jackfruit,"This is the largest tree-borne fruit in the world--it weighs up to 100 pounds. It's hard to find fresh in the United States, but Asian markets sometimes stock canned jackfruit. The yellowish pulp tastes a bit like banana. The seeds can be boiled and eaten. Watch out for the sap--it can stain your clothes.","jak, jakfruit, nankga",Artocarpus heterophyllus,"['breadfruit', 'papaya', 'pineapple', 'litchi']"
257,jalapeno pepper ,"These popular chilis have a good amount of heat and rich flavor. Green jalapenos are best in the late summer, while red jalapenos appear in the fall. Canned jalapenos aren't as fiery as fresh. When dried and smoked, this pepper is called a chipotle.",jalapeño Pepper,"Capsicum annuum, jalapeño","['cuaresmeno - fresh', 'Fresno pepper', 'guero pepper', 'melegueta pepper', 'Serrano pepper  ', 'yellow wax pepper ', 'cayenne pepper - fresh']"
258,Japanese chili,"These small red chilis are hot, and similar to the chile de arbol. Before using them, soak them in warm water for a few minutes.",chile japones,,['chile de árbol dried']
259,Japanese cucumber,"These are just like English cucumbers, only with bumps. Like English cucumbers, they don't have to be peeled or seeded.",,,['English cucumber']
260,Japanese eggplant,"Like other Asian eggplants, Japanese eggplants have thin skins, and a sweet, delicate flavor.","nasu, nasubi",Solanum melongena,"['Chinese eggplant', 'Italian eggplant']"
261,Jonagold apple,"This crisp, juicy apple is a Jonathan-Golden Delicious cross. It's a bit tart and good for eating out of hand.",,Malus domestica,"['Jonathan apple', 'McIntosh apple']"
262,Jonathan apple,"This tart apple is good for eating out of hand, though it has a fairly thick peel.",,Malus domestica,"['McIntosh apple', 'Pippin apple']"
263,juneberry,These are very similar to blueberries.,"chuckley pear, saskatoon, serviceberry, shadberry, shadbush, sugarplum",Amelanchier,"['blueberry', 'huckleberry']"
264,kabocha squash,"This orange-fleshed winter squash has a striated green rind. It's sweeter, drier, and less fibrous than other winter squash, and it tastes a bit like sweet potatoes.","Japanese pumpkin, Japanese squash, kabachi, nam gwa, sweet mama",Cucurbita maxima,"['butternut squash', 'acorn squash', 'turban squash']"
265,kabosu,,kabosu lime,Citrus sphaerocarpa,['lime']
266,Kadota fig, This has green skin and pinkish-white flesh.,,"Ficus carica, Kadota","['fig', 'dried fig']"
267,kaffir lime,"Thai cooks use these golf ball-sized limes to give their dishes a unique aromatic flavor. Kaffir limes have very little juice, usually just the zest is used. The leaves are also used in Thai cooking.","jeruk purut, leech lime, limau purut, magrood, makroot, makrut, Mauritius papeda, Thai lime",Citrus hystrix,"['citron', 'lime', 'kaffir lime leaf']"
268,kalamansi,The very sour kalamansi looks like a small round lime and tastes like a cross between a lemon and a mandarin orange. It's very popular in the Philippines.,"calamansi, calamansi lime, kalamansi lime, musk lime, musklime",Citrus microcarp,"['calamondin', 'lemon', 'mandarin orange']"
269,kalamansi juice,,"calamansi juice, musk lime juice, musklime juice",Citrus microcarp,"['kalamansi juice', 'mandarin orange juice', 'key lime juice', 'calamondin juice', 'lemon juice']"
270,Kalamata olives,"You can find these popular Greek black olives in most large supermarkets. They're salty and have a rich, fruity flavor. These can be eaten out of hand, or used to make tapenades.",Calamata olive,Olea europaea,"['Gaeta olives', 'Amphissa olives']"
271,Kashmiri red chili dried,This mild Kashmiri chili is used in Indian cooking to add flavor and color.,Kashmiri laal mirch,Capsicum annuum,['California chili ']
272,keriberry,These large berries taste like a cross between blackberries and raspberries.,,"Rubus rugosus,  thwaitsii",[]
273,kershaw squash,Kershaw squash is an heirloom squash. It is mostly grown in the American south. Kershaw squash was cultivated by native Americans.,"cushaw squash, Tennessee sweet potato",Cucurbita argyrosperma,"['pumpkin', 'winter squash']"
274,key lime,These are smaller and more acidic than the more common Persian limes.,"bartender's lime, Florida key lime, Mexican lime, Omani lime, West Indian lime",Citrus aurantiifolia,['lime']
275,key lime juice,"Freshly squeezed lime juice is vastly superior to what you'll find in bottles. Key limes and bottled key lime juice are widely available in the Southeast, and in specialty markets elsewhere. Liquor stores sometimes carry Rose's lime juice, which is sweetened key lime juice.",Mexican lime juice,Citrus aurantiifolia,"['lime juice', 'passion fruit juice', 'calamondin juice', ""Rose's lime juice""]"
276,khalas dates,Khalas dates originated in Saudi Arabia.,,Phoenix dactylifera,"['dates', 'raisins', 'dried fig']"
277,kharbouza melon,"This is a very crunchy, mildly sweet melon.",,Cucumis melo,[]
278,kimia dates,These dark kimia dates are grown widely in southern Iran. They are moist and soft.,,Phoenix dactylifera,"['dates', 'raisins']"
279,Kirby cucumber,"This short, versatile cucumber is used for both slicing and pickling.  It's small, with bumpy yellow or green skin.  Like the English cucumber, it has a thin skin and inconspicuous seeds.",,,['English cucumber']
280,kittely,Kittely is a small round eggplant. It is used in soups and stews.,"NganNgan, small bitterball",Solanum macrocarpon,['Eggplants']
281,kiwano,"This melon has a gorgeous orange rind with spikes--poke a stick in it and you'd have a medieval mace for a Halloween costume. The yellow-green flesh has the consistency of jello, and tastes a bit like cucumbers.","African horned cucumber, African horned melon, cherie, English tomato, hedged gourd, horned melon, jelly melon, kiwano melon, melano, spiked melon",Cucumis metuliferus,"['cucumber', 'melons']"
282,kiwi fruit,"This small, oblong fruit is has fuzzy brown skin and beautiful green flesh dotted with edible black seeds. It tastes like a cross between gooseberries and strawberries. It's very versatile--you can eat it as a snack, blend it into sauces or sorbets, or peel and slice it as a garnish. It also contains an enzyme that tenderizes meat. Select kiwis that are hard, and allow them to ripen at room temperature for a few days.","Chinese gooseberry, kiwi, kiwifruit, monkey peach, yang-tao","Actinidia deliciosa, Hayward","['gooseberry', 'strawberry', 'papaya', 'pear']"
283,kokum,This Indian souring agent is made from dried mangosteen peels. It's often used in fish dishes. Look for it in Indian markets.,"cocum, kokum ful",Mangifera,['tamarind paste']
284,kumquat,"These look like grape-sized oranges, and they can be eaten whole. The flavor is a bit sour and very intense.  They peak in the winter months.",,Citrus japonica,"['limequat', 'calamondin', 'Seville orange']"
285,kumquats in syrup,,,,['fig preserves']
286,Kura olives,This Middle Eastern cracked green olive is hard to find in the U.S.,,Olea europaea,['Nafplion green olives']
287,Lady apple,"These are very small apples, and usually used for decoration.",,Malus domestica,[]
288,lamuyo pepper,"This hard-to-find sweet pepper is smaller and sweeter than its cousin, the bell pepper, with which it's interchangeable.","European sweet pepper, rouge royal",Capsicum annuum,['bell pepper']
289,langsat,This sweet and sour fruit from Southeast Asia looks like a small potato. Don't eat the bitter seed inside.,"duku, lansek, lanson, lanzon, lanzone",,[]
290,lemon,"This very sour citrus fruit is rarely eaten out of hand, but it's widely used for its juice, rind, and zest.  Varieties include the Eureka lemon, which is what you're most likely to find in markets, the Lisbon lemon, which shows up in the winter and is smaller and smoother than the Eureka, and the trendy Meyer lemon, which is much sweeter and pricier than an ordinary lemon. When buying lemons, select specimens that are smaller, thin-skinned, and heavy for their size.",,Citrus limon,"['grapefruit', 'lime', 'citron', 'lemongrass']"
291,lemon cucumber,"This versatile cucumber is sweet and flavorful, and doesn't have much of the chemical that makes other cucumbers bitter and hard to digest. Though it's often served raw, it's also a good pickling cucumber.",,,"['garden cucumber', 'cucumber']"
292,lemon juice,Freshly squeezed lemon juice tastes much better than bottled juice.,,Citrus limon,"['lime juice', 'key lime juice', 'malt vinegar', 'water']"
293,lemon marmalade,"This is made by boiling the fruit and peel of lemons with sugar, pectin, and water. It manages to be bitter, sour, and sweet all at once, which many people find delightful.",,,['orange marmalade']
294,lemon zest,,,Citrus limon,"['lemon peel, dried', 'lemon juice']"
295,lighter Bake,This is a mixture of pureed prunes and apples that serves as a fat substitute in baking.,Sunsweet Lighter Bake,,['puréed prunes']
296,Ligurian olives,These small Italian olives are brine-cured.,"Liguria olive, Taggiasca olive",Olea europaea,['Nicoise olives']
297,lime,"These tart green fruits are similar to lemons, but they're more acidic and have their own unique flavor. Varieties include the common Persian lime = Tahiti lime and the smaller, less juicy, and more acidic Florida key lime = key lime = Mexican lime. When buying limes, select specimens that are dark green, smaller, thin-skinned, and heavy for their size.",Persian lime,Citrus latifolia,"['lemon', 'kalamansi']"
298,lime juice,,Persian lime juice,Citrus latifolia,"['key lime juice', 'lemon juice']"
299,lime zest,,,Citrus latifolia,"['lime juice', 'lemon zest']"
300,limequat,"This is a cross between a lime and a kumquat.  It's similar in size and shape to a kumquat, but with a green or yellow-green skin.  It has a strong lime flavor.",,Citrus floridana,['kumquat']
301,lingonberry,"These tart relatives of the cranberry grow only in cold climates. They're often made into jams, juices, sauces, syrups, or compotes. Scandinavians like to serve sweetened lingonberries with game.","cowberry, mountain cranberry, partridgeberry",Vaccinium vitis-idaea,"['cranberry', 'red currant']"
302,litchi,"his popular Chinese fruit is about the size of a walnut, with a bumpy red shell encasing white translucent pulp that's similar in texture to a grape. The flavor is sweet, exotic, and very juicy. Don't eat the shell or the seed. Fresh litchis are available from May to July.  If you can't find them, canned litchis are a good substitute.  Don't confuse fresh litchis with litchi nuts, which are sun-dried litchis that have a much different texture.","laichee, leechee, lichee, lichi, lychee",Litchi chinensis,"['rambutan', 'longan', 'grapes']"
303,litchi nut,These are sun-dried litchis. The outer shells are brown and the meat inside looks like a large raisin. Look for them in Asian markets.,"leechee nut, lichee nut, lichi nut, lychee nut",Litchi chinensis,"['prune', 'cashew']"
304,loganberry,"These are like blackberries, only they're dark red when ripe and more acidic.  They're especially good in pies and preserves.",,Rubus loganobaccus,"['raspberry', 'blackberry', 'boysenberry', 'olallieberry', 'youngberry', 'dewberry']"
305,loganberry jam,,,Rubus loganobaccus,"['raspberry preserves', 'gooseberry preserves', 'cloudberry preserves']"
306,longan,"Longans are very similar to lychees and rambutans. You can buy them fresh (in the summer), dried or canned.","dragon's eyes, lungan",Dimocarpus longan,"['litchi', 'rambutan']"
307,loquat,"These are popular in Asia, where they're eaten raw and cooked into sauces that accompany meat. They bruise very easily, which may explain their rarity in American markets","Chinese plum, Japanese medlar, Japanese plum, nespolo, pipa",Eriobotrya japonica,"['sour cherry', 'quince', 'mango', 'plum', 'apple', 'pear']"
308,Lucque olives,These green olives are brine-cured.,,Olea europaea,"['Picholine olives', 'Cerignola olives']"
309,Lugano olives,These are salty Italian/Swiss brownish-black olives.,,Olea europaea,[]
310,mabolo,These look like rust-colored fuzzy apples.,velvet apple,,['peach']
311,Macoun apple,This juicy apple is good for eating out of hand.,,Malus domestica,"['Jonathan apple', 'McIntosh apple']"
312,mamey sapote,"These are about the size of a large sweet potato. The flesh is salmon-colored, with a sweet, berry-like flavor. They're great for eating out of hand, or for making fruit salads or smoothies. Markets often sell them while they're still hard and underripe, so you need to set them on the counter for a few days until they yield when gently squeezed. Peel them and remove the seeds before serving.","mamey, mammee",Pouteria sapota,"['white sapote', 'sapote']"
313,mandarin orange,"These have a pleasant enough flavor, but their big asset is that they come out of their peels and segment easily, so you can eat them in your good clothes. Varieties include the popular tangerine, the seedy but juicy honey tangerine = Murcott, the satsuma orange, the sweet and tiny clementine orange, and the seedy and orange-flavored temple orange.","tangerine, temple orange",Citrus reticulata,['orange']
314,mandarin orange juice,,,Citrus reticulata,['orange juice']
315,mango,"It's always a challenge to eat a mango. The pulp clings desperately to both peel and seed, and it can turn into a mushy mess by the time you free it. Despite this, the mango is one of the most popular fruits in the world. It's sweet and juicy, and it has a wonderful, distinctive flavor. Select richly colored, firm mangoes, then let them ripen at home for a few days. Frozen mangoes are good substitutes for fresh.",,Mangifera,"['peach', 'nectarine', 'papaya']"
316,mangosteen,"Some claim that this is the most delicious fruit on the planet, though it's hard to find in the United States. It's about the size of a tomato, and has a leathery, mottled skin.",mangostan,Garcinia mangostana,"['strawberry', 'mango']"
317,manzana chili,This habanero relative is often used in salsas. It has black seeds. These are hot.,manzana chile,,"['habanero - fresh', 'Scotch bonnet chili']"
318,Manzanilla olives,These green olives are available in most supermarkets. They're often pitted and stuffed with pimento or garlic. They're often put into martinis.,Spanish olive,Olea europaea,['caper berry']
319,marang,Marang is similar to jackfruit and durian. It has a strong but sweet taste. Marang is native to Borneo and Mindanao.,"green pedalai, johey oak, kiran, madang, terap, timadang",Artocarpus odoratissimus,"['jackfruit', 'durian']"
320,maraschino cherry,These sugar-soaked and dyed cherries come in two colors: red (almond flavored) or green (mint flavored). Cooks usually use them to garnish desserts and drinks.,,,['cherry flavoring']
321,Marche olives,,,Olea europaea,[]
322,marionberry,"After Washington, D.C., mayor Marion Barry was arrested for possessing cocaine in 1989, marion berry jam enjoyed brief popularity as a novelty item.",,Rubus L. subgenus Rubus,['blackberry']
323,McIntosh apple,"These soft apples are great for snacking or for making applesauce, but don't bake them or put them in pies.",,Malus domestica,['Cortland apple']
324,Mediterranean cucumber,,,,['cucumber']
325,medjool dates,"These large sweet medjool dates are very popular. If picked early they are called rutab dates. They originated in Tafilalt, Morocco but are enjoyed around the world.","Majhul, Medjool, rhutab medjool, rutab medjool","Phoenix dactylifera, Majhul","['dates', 'dried fig', 'raisins']"
326,Mexican avocado,"With their small size and shiny black skins, these look like elongated plums.  You can eat them, skin and all",,Persea americana,"['avocado', 'Mexicola avocado', 'chayote', 'fresh peas', 'asparagus', 'broccoli', 'artichoke hearts']"
