,Name,Description,Also known as,Scientific name,Substitutions
79,cayenne pepper - fresh,"These are often used in Cajun recipes.  Green cayennes appear in the summer, while hotter red cayennes come out in the fall. They are very hot.","bird pepper, finger chili, ginnie pepper",Capsicum annuum,"['chile de árbol dried', 'Thai chili pepper - fresh', 'habanero - fresh', 'jalapeno pepper ', 'Serrano pepper  ', 'cascabel pepper - dried', 'pequin pepper dried', 'tepin dried', 'Holland chili', 'cherry pepper']"
80,cayenne pepper dried,"These are very hot, bright red chilies. Recipes that call for cayenne pepper are likely referring to a ground powder that goes by the same name, or possibly to the fresh version of the pepper.",Ginnie pepper,Capsicum annuum,"['chile de árbol dried', 'guajillo chili ']"
81,celeriac,"This underrated vegetable is a relative of celery that's been developed for its root, which has a pleasant celery flavor. It's popular in France and Northern Europe, where it's usually peeled and cooked in stews or grated and served raw. Many large supermarkets carry celeriac; select smallish roots that are heavy for their size.","céleri-rave, celery knob, celery root, Germany celery, knob celery, soup celery, turnip celery, turnip-rooted celery","Apium graveolens, rapaceum","['turnip', 'celery ribs', 'parsley root', 'celery seed']"
82,celery,"Raw celery is flavorful and wonderfully crunchy, and it's a great vehicle for dips or fillings like peanut butter or cream cheese.  Celery can also be sautéed and used to flavor soups, stews, and sauces.  A bunch or stalk of celery consists of a dozen or so individual ribs, with the tender innermost ribs called the celery heart.","céleri, seleri",Apium graveolens,"['carrot', 'fennel', 'Chinese celery', 'bok choy', 'cardoon', 'jicama']"
83,celery leaves,,,Apium graveolens,"['Bibb lettuce', 'Boston lettuce', 'parsley', 'celery seed', 'fenugreek leaves', 'lovage', 'trefoil']"
84,celery ribs,,,Apium graveolens,['celeriac']
85,celtuce,"This is a kind of lettuce that's grown for its stalk, which can be peeled, sliced, and stir-fried.  Look for it in Asian markets.","asparagus lettuce, celery lettuce, Chinese lettuce, stem lettuce, wosun","Lactuca sativa, augustana",['celery']
86,Cerignola olives,These sweet Italian olives are large enough to stuff. Black Cerignolas are softer than green Cerignolas.,Bella di Cerignola,Olea europaea,"['Lucque olives', 'Picholine olives']"
87,chanar,"The fruit and seeds of the chanar tree are edible. In Chile, it is ground up to make a sauce (arrope). It is similar to honey or molasses.","Chilean palo verde, kumbaru",Geoffroea decorticans,"['molasses', 'honey']"
88,chanterelle,"Chanterelles are a whole family of mushrooms, most of which are quite choice, but the name is most often applied to the golden chanterelle = yellow chanterelle.  These yellow mushrooms are highly prized for their exquisite flavor, color, and texture.   Other tasty chanterelle varieties include the yellow foot chanterelle, which is less meaty and less flavorful than other varieties, the black trumpet mushroom, and the white chanterelle, which is similar to the golden chanterelle, but lighter in color.  Fresh chanterelles are best; dried or canned chanterelles are less flavorful and tend to have a rubbery texture","egg mushroom, girole, golden chanterelle, pfifferling, white chanterelle, yellow chanterelle, yellow foot chanterelle",Cantharellus californicus,"['hedgehog mushroom', 'white mushroom', 'oyster mushroom', 'morels']"
89,chaya,,tree spinach,Cnidoscolus aconitifolius,['spinach']
90,chayote,"This mild-flavored squash looks like a wrinkled, pale green pear.  It needs to be cooked before serving, and for a longer time than other summer squash.  You should peel a chayote before cooking it, but don't take the seed out--it's edible and tasty.  Cooked chayotes make good low-fat substitutes for avocados.","cho-cho, chocho, choko, christophene, christophine, chuchu, custard marrow, mango squash, mirliton (in the South), pear squash, pepinella, pepinello, sousous, vegetable pear, xoxo, xuxu",Sechium edule,"['zucchini', 'kohlrabi', 'summer squash', 'carrot', 'bell pepper']"
91,chepil,Look for this in the produce section of Hispanic markets.,"chepilin, longbeak rattlebox",Crotalaria longirostrata,['green bean']
92,cherry pepper,"Along with pepperoncini, this is a good pickling pepper. They are moderately hot, and range in color from orange to bright red.","bird cherry pepper, cherry bell pepper, cherry chile, cherry chili, Creole cherry pepper, hot cherry pepper, Hungarian cherry pepper, pimiento pepper, wiri-wiri",,"['cayenne pepper - fresh', 'pepperoncini']"
93,cherry tomato,"These are less than an inch in diameter, perfect for adding to salads or crudité platters, or grilling on skewers.  There are both red and yellow varieties.",,"Solanum lycopersicum, cerasiforme","['teardrop tomato', 'slicing tomato']"
94,chestnut mushroom,,,Agaricus bisporus,[]
95,chia sprouts,"These resemble alfalfa sprouts, and can be harvested right off that ceramic chia pet you got as a gift.",,Salvia hispanica,"['alfalfa sprouts', 'mung bean sprouts']"
96,chicken-of-the-woods mushroom,"This got its name because it has the texture of cooked chicken.  You can sauté it or, if you want to make mock chicken, simmer it in chicken stock.",sulfur mushroom,Laetiporus speciosus,"['portobello mushroom', 'cremini mushroom', 'shiitake mushroom', 'porcini']"
97,chilaca pepper,"When dried, a chilaca pepper is called a pasilla chile. They are mild.",chile chilaca,Capsicum annuum,"['poblano pepper ', 'pasilla chili']"
98,Chilcostle chili,"This hard-to-find and moderately hot Mexican chili is used in soups, stews, tamales, and mole sauces. It imparts a yellowish color to dishes.",chile chilcosle,Capsicum annuum,[]
99,chile de árbol dried,"Unlike many chilies, these remain bright red even after drying, so they're a favorite for making chili wreaths. They're very hot and somewhat acidic. Don't confuse the dried version with the fresh or powdered versions, which go by the same name.","arbol chile, bird's beak chili, chile árbol, rat's tail chili, red chile","Capsicum annuum, De Árbol","['cayenne pepper dried', 'pequin pepper dried']"
100,Chilhuacle negro chile,This excellent Mexican chili is loaded with flavor but hard to find. It's used to make mole negro and bean dishes. It is moderately hot.,,Capsicum annuum,[]
101,Chinese artichoke,"These look a bit like caterpillars, and they taste like Jerusalem artichokes. They're popular in France but hard to find in the U.S. Your best bet would be an Asian market.","artichoke betony, chorogi, crosne, Japanese artichoke, knotroot",Stachys affinis,"['Jerusalem artichoke', 'salsify']"
102,Chinese broccoli,"Like rapini, Chinese broccoli has small stems and green heads (which actually are flowers) and lots of leaves. But Chinese broccoli is leafier and less bitter than rapini. It's a great vegetable to stir-fry, but you can also steam or boil it, as you would broccoli.","Chinese kale, gai lan, gai lum, kai lan","Brassica oleracea, alboglabra","['broccoli raab', 'broccoli', 'bok choy']"
103,Chinese celery,"This has a stronger flavor than ordinary celery, and it's often used in stir-fries and soups.   Look for it in Asian markets.","khuen chai, kinchay","Apium graveolens, secalinum",['celery']
104,Chinese eggplant,"Compared to the familiar American eggplant, Chinese eggplants have thinner skins, a more delicate flavor, and not as many of the seeds that tend to make eggplants bitter.",qiézi,Solanum melongena,"['Japanese eggplant', 'Italian eggplant']"
105,Chinese spinach,"This is similar to spinach, only it's prettier, tastier, and more nutritious.  Look for it in Asian markets.","amaranth, een choy, hiyu, hon-toi-moi, hsien tsai, red calaloo, yin choy",Amaranth gangeticus,"['spinach', 'callaloo']"
106,chipotle negro chile,"These are darker, milder versions of the chipotle chile.","black chipotle, chipotle mora, mora, red-black chipotle",,['chipotle pepper ']
107,chipotle pepper ,"These dried and smoked jalapeño peppers lend a wonderful, complex flavor to sauces. They're usually rehydrated and canned in adobo sauce, but you can also buy them dried in cellophane bags. They are medium hot.","chile seco, jalapeno pepper dried, meco, smoked jalapeno pepper","Capsicum annuum, jalapeño","['jalapeno pepper ', 'morita pepper', 'mora chili', 'ancho chili']"
108,choy sum,"This is a general term in Chinese for the tender inner stalks and flowers of green vegetables. White choy sum usually refers to bok choy, while green choy sum refers to yau choy.","cai xin, Chinese flowering cabbage, choi sum","Brassica rapa, parachinensis","['bok choy', 'spinach']"
109,chrysanthemum leaves,"This Asian potherb is used to flavor salads, soups, sukiyaki and other dishes.  The leaves are usually blanched briefly to soften them and deepen their color, but young leaves can be served raw.  Add them to cooked dishes at the last minute, as they become bitter if overcooked.
Some people may have an alergic reaction to chrysanthemum leaves.","chop suey greens, garland chrysanthemum, shungiku, tong ho, tung ho",Chrysanthemum indicum,[]
110,cinnamon cap mushroom,Cinnamon cap mushrooms have a firm texture and an earthy flavor.,cinnamon webcap,Cortinarius cinnamomeus,['shiitake mushroom']
111,cipollini onion,"These round, flat Italian onions are about one to two inches in diameter.  They're available in the fall.","Borettana onion, cippolini onion",Allium,"['boiling onion', 'pearl onion', 'shallot']"
112,clamshell mushroom,Varieties include the brown clamshell mushroom (left).  This mushroom goes well with seafood or meats.  Cook them before eating.,"Beech Mushroom, Brown Beech Mushroom, brown clamshell mushroom, clam shell mushroom",Hypsizygus tessellatus,[]
113,cloud ear mushroom,"It's hard to find these fresh, but dried cloud ears are an excellent substitute.  Reconstitute them by soaking or simmering them in lots of water for a few hours.","black fungus, black Treasure, bok née, cloud ear fungus, hairy wood ear, jamur kuping, Jelly ear, mo-er mushroom, wood ear fungus",Auricularia polytricha,['wood ear mushroom']
114,coconut shoots,,,Cocos nucifera,['bamboo shoots']
115,collard greens,"This is a favorite of Southern cooks, who often cook them with salt pork or smoked ham hocks.  Frozen collards are an acceptable substitute for fresh.","collards, couve, dark cabbage, raštika",Brassica oleracea,"['kale', 'kohlrabi greens', 'bok choy', 'turnip greens', 'mustard greens']"
116,coriander root,"Thai recipes sometimes call for these roots, but they're hard to find in markets. The best source is to pull out a cilantro plant in your garden, or you can use cilantro stems instead.","Chinese parsley root, cilantro root",Coriandrum sativum,['cilantro']
117,corn salad,Corn salad has tender leaves and a very mild flavor.,"doucette, fetticus, field salad, lamb's lettuce, mache, nut lettuce, raiponce",Valerianella locusta,"['butterhead lettuce', 'Bibb lettuce']"
118,Costeño Amarillo,"This yellow Mexican chili is used to make soups, stews, and mole sauces. It's fruity and moderately hot and somewhat hard to find.","bandeño, chile costeño, Costeno amarillo ",Capsicum annuum,['guajillo chili ']
119,cousa squash,"This Middle-Eastern summer squash looks a lot like spaghetti squash, only it has a thin, edible skin. It's similar to zucchini, but its larger size makes it a natural for stuffing.","couza squash, kousa",,['zucchini']
120,cracked Provencal,These aromatic  green olives are marinated in a solution with herbes de Provence.,cracked Provençal,Olea europaea,[]
121,cremini mushroom,"These are closely related to common white mushrooms, but they're a bit more flavorful.  Large cremini mushrooms are called portobello mushrooms.","baby bella, brown mushroom, crimini mushroom, Italian brown mushroom, Italian mushroom",Agaricus bisporus,"['white mushroom', 'portobello mushroom', 'shiitake mushroom']"
122,cress,"This is a peppery green that's great in salads, sandwiches, and soups.  It's attractive enough to make a good garnish as well.  There are several varieties, including watercress, upland cress, curly cress, and land cress. Cress is highly perishable, so try to use it as soon as possible after you buy it.","curly cress, Garden cress, land cress, upland cress",,"['arugula', 'daikon sprouts', 'spinach', 'dandelions', 'Belgian endive', 'purslane']"
123,cuaresmeno - fresh,They are moderately hot.,,,"['jalapeno pepper ', 'Serrano pepper  ']"
124,cubanelle,"These sweet, mild peppers are usually sold while yellowish-green. They become hotter and redder as they mature.","Cuban pepper, cubanelle pepper, Friarelli, Green cubanelle, Italian frying pepper",Capsicum annuum,['bell pepper']
125,cucuzza,,"bottle gourd, calabash, cucuzzi, Italian squash, New Guinea bean, suzza melon, Tasmania bean, zucca",Lagenaria siceraria,"['zucchini', 'yellow squash']"
126,curly endive,"You can use this crisp, bitter green in salads or cook it as a side dish.  The outer leaves are green and somewhat bitter; the pale inner leaves are more tender and mild.  Don't confuse this with Belgian endive, which the British call chicory and the French call endive.","chicorée frisée, chicory, chicory endive, curly chicory, frise, frisee, frisée","Cichorium endivia, crispum","['escarole', 'radicchio', 'dandelions', 'mustard greens']"
127,currant tomato,These are about half the size of cherry tomatoes.,pimp,Solanum pimpinellifolium,"['cherry tomato', 'teardrop tomato', 'grape tomato']"
128,daikon,"Daikon is larger and milder than its relative, the red radish. The Japanese like to grate it and serve it with sushi or sashimi, but you can also pickle it, stir-fry it, or slice it into salads. Japanese daikons tend to be longer and skinnier than their Chinese counterparts, but the two varieties can be used interchangeably. Choose specimens that are firm and shiny. They don't store well, so try to use them right away.","Chinese radish, icicle radish, Japanese radish, lo bak, lo pak, loh baak, loh buk, long white radish, mooli, Oriental radish, white radish, winter radish",Raphanus sativus,"['jicama', 'turnip', 'radish', 'black radish', 'pickled ginger', 'parsnip']"
129,daikon sprouts,"These have a pungent, peppery flavor that works wonders for otherwise bland salads and  sandwiches.  They're too delicate to cook, so always serve them raw.","clover radish, kaiware, radish sprouts, tsumamina",Raphanus sativus,['onion sprouts']
130,dandelions,"Dandelions have a somewhat bitter flavor, which Europeans appreciate more than Americans.   Older dandelion greens should be cooked; younger ones can be cooked or served raw as a salad green.  They're available year-round, but they're best in the spring.",dandelion greens,Taraxacum officinale,"['watercress', 'curly endive', 'escarole', 'arugula', 'collard greens']"
131,delicata squash,"This is one of the tastier winter squashes, with creamy pulp that tastes a bit like sweet potatoes.  Choose squash that are heavy for their size.","Bohemian squash, sweet potato squash",Cucurbita pepo,"['butternut squash', 'buttercup squash', 'sweet potato']"
132,dragon tongue bean,"You can eat these, pods and all, just like green beans.",,Phaseolus vulgaris,['green bean']
133,dried eggplant,Look for these in Middle Eastern markets.,,Solanum melongena,[]
134,dulse,"This is a salty seaweed, so it makes a great salt substitute in soups and stews.  Some people eat it raw, like beef jerky.  It's rich in iron.","creathnach, dillisk, red dulse, sea lettuce flakes",Palmaria palmata,"['Wakame', 'arame', 'hijiki', 'sea lettuce']"
135,edamame,"These are fresh soybeans, that are usually sold shelled and frozen, but you can sometimes find them in the produce section, still in their pods. They're rich in protein, fiber, and other nutrients.Fresh edamame pods make great, healthy appetizers. Just steam the pods and have your guests split the pods open and eat the beans inside.Edamame, whether fresh or frozen, is terrific in soups and salads. ","beer bean, edible soybean, garden soybean, green soybean, immature soybean, sweet bean, vegetable soybean",Glycine max,"['garden pea', 'fresh black-eyed pea']"
136,Eggplants,"This is a spongy, mild-tasting vegetable that's meaty yet low in calories. It's never eaten raw, but it can be baked, grilled, or sautéed. The best eggplants are shiny, firm (but not too hard), and heavy for their size, with bright green stems and unbroken skin. Smaller eggplants tend to have fewer bitter seeds, as do ""male"" ones with round scars at their blossom (non-stem) end. (The scars on ""female"" eggplants look like dashes.) Freshness is important, so don't store eggplants for very long.","aubergine, berenjena, brinjal, egg apple, garden egg, Guinea squash, melanzane, melongene, patlican",Solanum melongena,"['zucchini', 'okra', 'portobello mushroom']"
137,elephant garlic,"This looks like an overgrown garlic, but it's more closely related to a leek. It's much milder than ordinary garlic, so it's a good choice if you want to impart the flavor of garlic to a delicately flavored dish. It's often sold in a mesh stocking to keep the cloves together.","great-headed garlic, Oriental garlic",Allium ampeloprasum,['garlic']
138,empeltre olives,These Spanish black olives are soaked in sherry.,,Olea europaea,[]
139,endigia,This crunchy new French variety blends sweet and bitter flavors.,red endive,Cichorium endivia,"['Belgian endive', 'radicchio']"
140,endive,"This category includes Belgian endive, curly endive, frisee, and escarole.",,Cichorium endivia,"['radicchio', 'curly endive', 'Belgian endive']"
141,English cucumber,"This foot-long slicing cucumber is pricier and less flavorful than other varieties, but it has less conspicuous seeds, a thinner skin, and a plastic wrapper--instead of a wax coating--to improve shelf life.  All of this saves preparation time, since there's no need to peel or seed the cucumber before slicing it.  This is a good variety if you focused on looks--you can cut it into round, green trimmed slices.","burpless cucumber, English cucumber, European cucumber, gourmet cucumber, greenhouse cucumber, hothouse cucumber, seedless cucumber",,"['Japanese cucumber', 'garden cucumber']"
142,enoki mushroom,Enoki mushrooms have a delicate fruity flavor.  They're usually served raw.,"enok, enokidake, enokitake, futu mushroom, golden mushroom, golden needle mushroom, snow puff mushroom, velvet foot mushroom, velvet stem mushroom, winter mushroom",Flammulina velutipes,"['oyster mushroom', 'white mushroom']"
143,eryngii mushroom,,"ali?i oyster, boletus of the steppes, eringii mushroom, French horn mushroom, king oyster mushroom, king trumpet mushroom",Pleurotus eryngii,['matsutake mushroom']
144,escarole,"Escarole has sturdy leaves and a slightly bitter flavor.  Young escarole leaves are tender enough to add to salads, otherwise escarole is best cooked as a side dish or used in soups.","Batavia, Batavian endive, Bavarian endive, broad-leaved endive, grumolo, scarole","Cichorium endivia, latifolia","['curly endive', 'radicchio', 'borage', 'mustard greens', 'arugula', 'spinach', 'kale']"
145,fairy-ring mushroom,,"elf circle, fairy circle",Marasmius oreades,"['white mushroom', 'chanterelle']"
146,fennel,"Fennel tastes like licorice or anise, and it's commonly used in Italian dishes.  It's very versatile; you can sauté it and add it to sauces, braise it as a side dish, or serve it raw as a crudité.","anise (incorrectly), bulb fennel, finocchio (Italian), Florence fennel, garden fennel, sweet anise (incorrectly), sweet fennel",Foeniculum vulgare,"['fennel seed', 'celery', 'onion', 'anise-flavored liqueurs', 'udo', 'celery']"
147,fennel leaves,"For more information, see the Wegman's Food Market's page on Fennel.",fennel feathers,Foeniculum vulgare,"['avocado leaves', 'hoja santa leaves', 'parsley']"
148,fenugreek sprouts,,,Trigonella foenum-graecum,"['mung bean sprouts', 'alfalfa sprouts']"
149,fiddlehead fern,"When a fern first emerges from the ground, its uncoiled frond is called a fiddlehead. Edible varieties of fiddleheads include those from the ostrich fern and the less common wood fern. They're available in the late spring and early summer. Select the smallest, freshest-looking fiddleheads you can find. Warning: Fiddleheads from bracken ferns resemble those from ostrich ferns, but are believed to be carcinogenic. Be very careful if you're gathering fiddleheads from the wild. Undercooked ostrich fern fiddleheads also have been linked to some cases of food poisoning.","fern, fiddlehead greens, lady fern, ostrich fern, pohole, royal fern, vegetable fern, western sword fern",,"['asparagus', 'green bean', 'spinach']"
150,Filipino eggplant,,,Solanum melongena,[]
151,fingerling potato,"There are many varieties of these small, finger-shaped potatoes, but they all tend to be low in starch, and great for roasting or making potato salads.","French fingerling, Russian banana",Solanum tuberosum,['new potatoes']
152,fingerroot,This ginger relative is popular in Thailand. It resembles long fingers jutting from a hand.,"Chinese ginger, Chinese key, ka chai, kra chai, krachai, lesser galangal",Boesenbergia rotunda,"['lesser galangal', 'galangal', 'ginger root']"
153,flowering kale,This is a beautiful cabbage used more often as a garnish than as a vegetable.,"flowering cabbage, flowering cole, ornamental kale",Brassica oleracea,"['kale', 'collard greens']"
154,fresh beans,"Fresh beans appear in the summer and fall, and they're sweeter and more tender than dry beans. You don't need to soak them or cook them as long as dried beans, but they often need to be shelled before using.You can usually substitute them with dried beans pound for pound.","shellies, shellouts, shelly beans, shuckies",Phaseolus vulgaris,['dried beans']
155,fresh black-eyed pea,"In their fresh form, black-eyed peas are pale green and have a wonderful, nutty flavor.  Unlike dried black-eyed peas, they don't need to be soaked, and they cook much faster.  They arrive in markets during the late summer and early fall.","fresh black-eye bean, fresh black-eye pea, fresh black-eyed suzy, fresh chawli, fresh China bean, fresh cowpea, fresh crowder pea, fresh lobhia, fresh lombia, fresh poor man's pea, fresh Southern pea",Vigna unguiculata,['black-eyed pea']
156,fresh cannellini bean,,"fresh fazolia bean, fresh white kidney bean",Phaseolus vulgaris,['cannellini bean']
157,fresh cranberry bean,These are available in the summer months.,"fresh borlotti bean, fresh crab eye bean, fresh fagiolo romano, fresh Roman bean, fresh rosecoco bean, fresh saluggia, fresh shell bean, salugia bean",Phaseolus vulgaris,['cranberry bean']
158,fresh fava bean,"Fresh fava beans are available in the summer and are much better tasting than canned, dried, or frozen ones. Young fava beans need only be shelled, but more mature beans should also be peeled to rid them of the tough, waxy skin that surrounds each bean. The best way to do this is to blanch the shelled beans for a minute in boiling water, plunge them into cold water, and pull off the skins.Select large fava beans that don't have black spots on them, Larger ones are the best.About 400 million people worldwide have favism, an enzyme deficiency. Eating fava beans can cause adverse symptoms in some of them.","fresh broad bean, fresh butter bean, fresh English bean, fresh horse bean, fresh Windsor bean",Vicia faba,"['dried fava bean ', 'fresh lima bean', 'chickpea']"
159,fresh lima bean,"These are exquisitely sweet and tender, as long as you get to them soon after they're picked.   The freshest pods are brightly colored and snap crisply when you bend them.   Fresh lima beans don't need to be soaked and you need only cook them about 15 minutes.","fresh butter bean, fresh Madagascar bean, fresh wax bean",Phaseolus lunatus,"['garden pea', 'lima bean']"
160,fresh peas,"	Fresh peas are sweeter and more tender than their dry counterparts.  To shell one, just pull down the string and squeeze the pod at the seams, then scrape out the peas and discard the pods.  As with corn, freshness is crucial since peas begin converting their sugar into starch as soon as they're picked.  The freshest pods are brightly colored and snap crisply when you bend them.   Fresh peas don't need to be soaked and they cook fairly quickly.","shellies, shellouts, shellpeas, shuckies",Pisum sativum,"['avocado', 'Dried Peas']"
161,Fresno pepper,"These are similar to jalapeno peppers, but with thinner walls. They're great in salsas. Green Fresnos are available in the summer. the hotter red ones come out in the fall.","Fresno chile pepper, Fresno chili pepper",,"['jalapeno pepper ', 'Serrano pepper  ']"
162,Fuerte avocado,"This is in season from late fall through spring.  It's not quite as buttery as the Hass avocado, but its flavor is excellent.",Florida avocado,Persea americana,"['avocado', 'chayote', 'fresh peas', 'asparagus', 'broccoli', 'artichoke hearts']"
163,fuzzy melon,This sweet and mild squash has a fuzzy feel to it.,"Chi qua, fuzzy gourd, hairy cucumber, hairy melon, moqua, wax gourd","Benincasa hispida, chieh-qua",['zucchini']
164,Gaeta olives,"These are small, purple Italian olives are either dry-cured (making them black and wrinkled) or brine-cured (making them dark purple and smooth-skinned).",Gyeta olive,,['Kalamata olives']
165,gai choy,"Asian cooks like to pickle this, or else use it in soups or stir-fries.  If you find gai choy too pungent to stir-fry, blanch it first in salted water.","Chinese mustard cabbage, Chinese mustard greens, Indian mustard, kai choy, leaf mustard, Oriental mustard, vegetable mustard",Brassica juncea,"['mustard greens', 'broccoli raab']"
