,Name,Description,Also known as,Scientific name,Substitutions
110,saltine cracker,"These salty crackers are very crisp, and they're great for snacking.  They're often made into tiny sandwiches with cheese or peanut butter in the middle.","saltine, soda cracker",,"['water cracker', 'Ritz® cracker']"
111,sangak bread,"This Iranian flatbread is about two feet long, enough for the whole family.","Iranian bread, naneh, sangak",,"['pita bread', 'naan']"
112,scone,"These crumbly quick breads are often served at teatime in Britain.  They're usually split open and lathered with butter, jam, and/or clotted cream.  Americans pronounce the name SKONE, but the British and Australians say SKAHN.   They freeze well.",,,"['English muffin', 'shortcake']"
113,shortbread,These rich cookies are loaded with butter.,,,['butter cookie']
114,shortcake,"These sweetened biscuits are traditionally split in half and topped with whipped cream and strawberries.   You can buy them ready-made in stores, where they're often displayed near the strawberries, but they're easy to make from scratch.  Don't confuse shortcake with shortbread, a rich butter cookie.",shortbread cake,,"['pound cake', 'sponge cake']"
115,shortened cakes,"These cakes are made with butter or other solid fat, so they're richer and heavier than foam cakes.   Examples include pound cakes and butter cakes.",,,['foam cakes']
116,shrimp chips,"These Indonesian chips are made with tapioca and different flavorings. Before serving them, you're supposed to fry them in hot oil for a few seconds until they expand and become crunchy. Look for them in Asian markets.","Indonesian chips, krupuk",,['pappadam']
117,sope,Mexican cooks put various savory toppings on these corn patties.  Look for them in Hispanic markets.,,,"['corn tortilla', 'gordita']"
118,soup nuts,These matzo meal crackers are used in soups or ground into crumbs.,mandlen,,"['farfel', 'matzo meal', 'croutons']"
119,sourdough bread,"A San Francisco specialty, this is French bread made with a special starter of yeast and bacteria that imparts a pleasant, sour taste to the bread.  It's especially good with seafood.",,,['French bread']
120,sponge cake,"Like sponges, these cakes have lots of air pockets, which are made by beating egg whites and folding them into the batter. Angel food cakes are similar, but they're made without egg yolks, while sponge cakes are made with whites and yolks. A sponge cake will keep its shape better if you cut it with a serrated knife.","spongecake, sunshine cake",,"['génoise', 'angel food cake', 'pound cake', 'madeleine']"
121,starter breads,"These are breads that are made with a starter instead of fresh yeast.  A starter is a mixture of flour, water, and baker's yeast that been set out so that it can be colonized by airborne yeast and friendly bacteria.  Starters lend a special character to the bread--sourdough bread, for example, needs to be made with a starter to acquire a sour flavor.","pain au levain, pane lievito naturale",,[]
122,stollen,This rich German coffee cake is traditionally served at Christmas.,,,['raisin bread']
123,stuffing,"This is usually put inside a whole turkey to absorb flavorful juices while the bird roasts, but it can also be baked in a casserole dish.  It's usually made of small bread cubes or shredded pieces of bread that have been dried.   Commercial stuffing is convenient, but not as fresh-tasting as homemade stuffing.","dressing, stuffing croutons",,"['white bread', 'breadcrumbs', 'croutons', 'cornbread crumbs', 'Rice', 'potato']"
124,sweet biscuit crumbs,,,,['graham cracker crumbs']
125,taco shell,"These are crunchy corn tortillas that have been loosely folded and deep-fried.  You just fill them and serve.  Look for boxes of them among the Mexican foods in your supermarket, or make them yourself by deep-frying corn tortillas, forming them into a U-shape, then allowing them to harden into a crispy shell.",,,"['corn tortilla', 'flour tortilla', 'corn chips']"
126,tortilla,"These thin wraps are used to make countless Mexican dishes.   Corn tortillas have little or no fat, and they're the preferred tortilla for making tacos and enchiladas.  Flour tortillas are softer, higher in fat, and more pliable.  They're traditionally used to make burritos, chimichangas, fajitas, flautas, and quesadillas, though some cooks use them to make everything from spring rolls to peanut butter sandwiches.   Before filling tortillas, cook them briefly on a hot, dry frying pan or wrap them in damp paper towels and heat them in the microwave.   Store uncooked tortillas in the refrigerator or freezer.",,,"['chapati', 'naan', 'pita bread']"
127,tortilla chips,"These are tortilla wedges that have been deep-fried or baked.   They're often served with Southwestern-style dips, like salsa and guacamole.",,,"['corn chips', 'potato chips']"
128,Triscuit®,"These crunchy crackers are made of woven strands of whole wheat. They're often used as a base for appetizers, though some devotees eat them straight.  Reduced fat and low sodium versions are available.",,,"['Ritz® cracker', 'water cracker']"
129,vanilla wafer,"These vanilla cookies can be eaten as they are, but cooks often pound them into crumbs and use them to make pie crusts.",,,"['chocolate wafer', 'gingersnap']"
130,vanilla wafer crumbs,"These are often used to make pie crusts.  To make them, place vanilla wafers in a heavy plastic bag, seal, then crush the wafers with a rolling pin.",,,"['graham cracker crumbs', 'chocolate wafer crumbs', 'Oreo® cookie', 'gingersnap crumbs']"
131,water cracker,"These crunchy crackers have little flavor, making them a neutral foundation for spreads and appetizers.",water biscuit,,"['saltine cracker', 'Ritz® cracker', 'Triscuit®']"
132,wheatmeal biscuit,This is Australia's answer to America's graham cracker.,,,"['graham crackers', 'digestive biscuit']"
133,white bread,,,,['French bread']
134,zatar bread,,"manaeesh, manakeesh",,[]
135,zwieback,"These are slices of bread that have been baked a second time, making them crisp and dry.   Toddlers use them as teething biscuits, while adults add them to soups.",rusk,,['graham crackers']
