,Name,Description,Also known as,Scientific name,Substitutions
166,galangal,"Look for this in Asian markets. It's sold fresh, frozen, dried, or powdered, but use the dried or powdered versions only in a pinch.","galanga (ginger), galangale, galingale, greater galangal, Java galangal, Java root, kha, khaa, languas, laos (root or ginger), lengkuas, Siamese ginger, Thai ginger",Alpinia galanga,['ginger root']
167,gamboni mushroom,,big leg mushroom,,[]
168,garden cucumber,"You can find these throughout the year at all but the most poorly stocked markets.  The ones you find in supermarkets are usually waxed to hold in moisture and improve shelf-life--these should be peeled or at least scrubbed well before serving.  Unwaxed cucumbers don't need to be peeled, but better cooks often do so since the peels tend to be thick and bitter.  It's also a good idea to remove the seeds from these kinds of cucumbers; just cut them in half lengthwise and scrape them out.   Select cukes that are firm, dark green, and rounded at the tips.","field-grown cucumbers, market cucumber, outdoor cucumber, regular cucumber",,"['English cucumber', 'Japanese cucumber', 'Armenian cucumber', 'lemon cucumber']"
169,garden eggs,"These are tiny eggplants, the size of an egg or smaller. Their color ranges from white to greenish-yellow.",,Solanum melongena,[]
170,garden pea,"These appear in the summer months, and they're so sweet that it's well worth the trouble to shell them. Freshness is crucial, so look for brightly colored pods that are crisp enough to snap.  Petits pois are a small and tender variety.","English pea, fresh pea, green pea, shell pea",Pisum sativum,"['edamame', 'fresh lima bean']"
171,garlic,"Almost every cuisine on our planet has found an important role for garlic. Europeans mince it raw and add it to salad dressings, or sauté it and use it to flavor their sauces. Asian cooks add it to to their stir-fries; Indian cooks to their curries; Hispanic cooks to meats and vegetables. And Americans have lately taken a fancy to roasting whole bulbs, and then spreading the garlic like a soft cheese on bread or crackers. Garlic's good for you, too. Researchers believe that garlic can bolster the immune system, lower blood pressure and prevent heart disease, and at least some people believe that it can ward off vampires and insects. The only downside is that raw or undercooked garlic tends to linger on the breath, though many people are more than willing to pay that price. Types of garlic include the mild green garlic, the purple-skinned Italian garlic and Mexican garlic, and the common white-skinned garlic = California garlic, which is the most pungent of all.","California garlic, green garlic, Italian garlic, Mexican garlic, stinky rose, white-skinned garlic",Allium sativum,"['granulated garlic', 'garlic flakes', 'garlic powder', 'garlic salt', 'asafetida', 'rocambole', 'garlic juice', 'shallot', 'onion', 'garlic chives']"
172,garlic chives,,,Allium sativum,"['garlic greens', 'chives', 'onion']"
173,garlic flakes," When rehydrated in water, garlic flakes provide much of the flavor and texture of fresh garlic.","dehydrated minced garlic, dried garlic flakes",Allium sativum,['garlic']
174,garlic greens,,garlic sprouts,Allium sativum,['green onion']
175,garlic juice,These are sold in spray bottles or in small jars.  Look for them in the spice section of larger supermarkets.  To make your own:  Strain the juice from a jar of minced or pressed garlic.,,Allium sativum,"['granulated garlic', 'garlic powder']"
176,garlic powder,"Garlic powder provides some of the flavor, but not the texture, of fresh garlic.  It disperses well in liquids, so it's a good choice for marinades.",powdered garlic,Allium sativum,"['garlic', 'garlic salt', 'garlic juice', 'garlic flakes', 'granulated garlic']"
177,garlic salt,,,,['garlic powder']
178,gherkin cucumber,"These small, bumpy greed cucumbers are used to make Gherkin pickles or, if pickled while still small, cornichon pickles.",,,[]
179,ghost pepper,"Ghost peppers are a very hot (over 1,000,000 scovilles) hybrid between Capsicum chinese and Capsicum frutescens. It is grown and used in northern India.","bhut jolokia, king chili, king cobra chili, Tezpur chili",Capsicum chinese,"['habanero - fresh', 'Scotch bonnet chili']"
180,ginger root,"With its sweet yet pungent flavor, ginger has become a mainstay of many of the world's cuisines.  European cooks like to use dried, ground ginger to flavor gingerbread and other baked goods.  Asian and Indian cooks prefer their ginger fresh, and they use it in spicy sauces and stir-fries.  Ginger not only tastes good, it's also believed to have medicinal properties, and people sometimes use it to soothe their upset stomachs and boost their energy.   Ground ginger isn't a good substitute for fresh, but dried whole ginger will work in a pinch, as will the minced or puréed ginger that's sold in jars.","fresh ginger, geung, ginger, gingerroot, khing, shoga",Zingiber officinale,"['green ginger', 'galangal', 'crystallized ginger', 'allspice', 'coriander seeds']"
181,globe squash,"You can stuff these and bake them, or slice and sauté them.",Ronde de Nice,,['zucchini']
182,golden delicious squash,This is an orange-red variety of Hubbard squash,,Cucurbita maxima,['Hubbard squash']
183,golden nugget squash,"This has a pleasant flavor, but it doesn't have as much flesh as other squashes and the heavy rind makes it hard to cut before cooking.   Select specimens that are heavy for their size, and that have a dull finish.  Those with shiny rinds were probably picked too young, and won't be as sweet.",oriental pumpkin,Cucurbita maxima,['acorn squash']
184,granulated garlic,"Like garlic powder, granulated garlic provides the flavor, but not the texture, of fresh garlic.  It disperses well in liquids.",,,['garlic powder']
185,grape tomato,,,Solanum lycopersicum,"['teardrop tomato', 'currant tomato', 'cherry tomato']"
186,Greek black olives,"A generic black Greek olive is large, dark purple and brine-cured. Popular varieties include Kalamata, Amphissa, and Royal.",,Olea europaea,[]
187,Greek green olives,Napfilion and Ionian olives are the most common types of green Greek olives.,,Olea europaea,['Nafplion green olives']
188,green bean,"These are meant to be cooked and eaten, pods and all.  They're best if they're steamed or stir-fried just until they're tender but still crisp.  Select bright green beans that snap when broken in half.  Their peak season is in the summer.","Baguio beans, French beans, snap bean, string bean",Phaseolus vulgaris,"['wax bean', 'Italian flat bean', 'dragon tongue bean', 'winged bean']"
189,green cabbage,"Cabbage is quite versatile. You can cut it into chunks, boil it, and serve it with corned beef or other fatty meats. You can also use cooked leaves as wrappers for meat fillings, or shred raw ones for cole slaw. Select heavy heads of cabbage that have shiny leaves.",,Brassica oleracea,"['savoy cabbage', 'red cabbage', 'napa cabbage']"
190,green chile canned,,,,"['Anaheim chili', 'poblano pepper ']"
191,green ginger,"These pink-tipped, shiny pieces of young ginger are mild and usually don't need to be peeled.   They're easy to find in Asian markets.","baby ginger, new ginger, pink ginger, spring ginger, stem ginger, young ginger",Zingiber officinale,['ginger root']
192,green goddess eggplant,This has a very mild flavor.,,Solanum melongena,[]
193,green olives,"Green olives are picked from the tree before they're completely ripened. The most common variety is the Manzanilla olive, which is often pitted and stuffed. Other green olives varieties include the Agrinion, Arauco, Arbequina, Atalanta, green Cerignola, cracked Provençal, Kura, Lucque, Nafplion, Picholine, Sevillano, and Sicilian.",,Olea europaea,"['black olives', 'caper berry', 'cocktail onion']"
194,green onion,"These are onions that have small bulbs and long green stalks. They're usually eaten raw, but you can also grill or sauté them.  Some people also use the term green onions to refer to onion tops, shallot tops and young leeks.","bunching onion, cebollitas, Chinese onion, cibol, scallion, shallot (in Australia), sibies, spring onion (in Britain), stone leek",Allium cepa,"['spring onion', 'leek', 'shallot', 'chives']"
195,green tomato,These are picked before they turn red. Southerners like to fry them.,,Solanum lycopersicum,"['tomatillo', 'slicing tomato', 'bell pepper']"
196,green-leaf lettuce,,,Lactuca sativa,"['red-leaf lettuce', 'Bibb lettuce']"
197,guajillo chili ,"One of the more popular Mexican chilies, the guajillo (or dried mirasol chili) has a fruity flavor and medium heat (Scoville heat scale of 2,500 to 5,000 SHU). It's smooth, shiny, and reddish-brown, and it has a tough skin, so it needs to be soaked longer than other chiles.These are commonly used for marinades and adobos.","chile Guajillo, dried mirasol chile",Capsicum annuum,"['ancho chili', 'New Mexico red chili', 'pasilla chili', 'cascabel pepper - dried', 'mirasol pepper ', 'California chili ']"
198,guero pepper,These are moderately hot.,"caloro, caribe, chile guero, goldspike, Sante Fe grande, yellow hot chile",,"['jalapeno pepper ', 'Fresno pepper', 'Serrano pepper  ']"
199,habanero - dried,"Don't confuse dried habaneros with the fresh version, which goes by the same name. These extremely hot chiles are wrinkled and orange.","habañero chili, habañero pepper","Capsicum chinense, habanero",['chile de árbol dried']
200,habanero - fresh,These extremely hot orange chiles have a fruity flavor. They're best in the summertime.,habanero pepper,"Capsicum chinense, habanero","['Scotch bonnet chili', 'manzana chili', 'cayenne pepper - fresh', 'jalapeno pepper ', 'Serrano pepper  ']"
201,hair vegetable,The Chinese add this to soups and use it as a garnish.  Look for it in Chinese markets and pharmacies. It grows in the Gobi Desert.,"black flossy moss, black moss, fat choy, hair seaweed, hair-like vegetable",Nostoc flagelliforme,[]
202,hardneck garlic,"Hardneck garlic retains the stalk in the center of the bulb. They tend to have stronger flavors and do not store as long as softneck garlic. Hardneck garlics include purple stripe, rocambole, porcelain, and others.","Asiatic, Creole, porcelain, purple stripe, rocambole, Turban","Allium sativum, ophioscorodon",['softneck garlic']
203,haricot verts,"This is a very thin variety of green bean that's crisp, tender, and expensive.  Don't confuse this with the haricot bean, which is a dry bean.","French bean, French filet bean, French green bean",Phaseolus vulgaris,['green bean']
204,Hass avocado,"This is available year-round and has a rich flavor and creamy texture. The skin turns almost black when the avocado is ripe, which can camouflage bad bruises. This is the best variety by far for guacamole, but it turns a bit mushy in salads.",California avocado,Persea americana,"['avocado', 'chayote', 'fresh peas', 'asparagus', 'broccoli', 'artichoke hearts']"
205,Hawaiian eggplant,,,Solanum melongena,[]
206,hawk's wing mushroom,,,Polyporus squamosus,[]
207,hearts of palm,"These are peeled cabbage palm buds, and they're terrific in salads or as a vegetable side dish. You can buy them fresh only in Florida, but the canned version is quite good.","palm hearts, palmitos, swamp cabbage",Cocos nucifera,"['artichoke hearts', 'asparagus']"
208,hedgehog mushroom,Hedgehog mushrooms are similar to chanterelles in color and flavor.,"sweet tooth mushroom, wood hedgehog",Hydnum repandum,"['chanterelle', 'porcini']"
209,hijiki,"Hijiki has a mild flavor, so it's a good choice if you want to slip a sea vegetable unobtrusively into your soups and stews in order to fortify them with calcium, iron, and other nutrients.  When rehydrated, it roughly quadruples in size, so a little goes a long way.",hiziki,Sargassum fusiforme,"['arame', 'dulse']"
210,Holland bell pepper,"These are like bell peppers, only they're sweeter and have thicker walls. They come in different colors.",,Capsicum annuum,['bell pepper']
211,Holland chili,These are hot.,Dutch chile,,"['cayenne pepper - fresh', 'Fresno pepper']"
212,Holland eggplant,,,Solanum melongena,"['Italian eggplant', 'Chinese eggplant', 'zucchini', 'Eggplants']"
213,Hondroelia olives,"This is a juicy, meaty olive.",,Olea europaea,[]
214,honey mushroom,,Honey fungus,Armillaria mellea,"['shiitake mushroom', 'hedgehog mushroom']"
215,hontaka pepper - fresh,,,,[]
216,horseradish,"This is a very pungent brown root that's usually peeled and grated to make a condiment for meats. Its intense flavor and aroma dissipate quickly when exposed to air, so it should be grated just before serving or mixed with something sour (like vinegar, lemon juice, or beet juice) to lock in the heat. It's easiest to use a blender or food processor to grate it. Fresh horseradish is surprisingly potent, so make sure your kitchen is well ventilated, wear rubber gloves, and don't rub your eyes.","German mustard, khren, kren, Meerrettich",Armoracia rusticana,"['wasabi', 'horseradish (prepared)', 'black radish']"
217,Hubbard squash,"This variety has tasty flesh, but it's too large for many families to handle and the rind is hard to cut though. Some grocers cut them into smaller pieces before putting them out.",,Cucurbita maxima,"['pumpkin', 'golden delicious squash', 'buttercup squash', 'butternut squash', 'banana squash', 'green papaya']"
218,huckleberry potato,,,Solanum tuberosum,[]
219,huitlacoche,"This is a fungus that forms black kernels on ears of corn in damp weather. It's a prized delicacy in Mexico, and tastes a bit like wild mushrooms. You can get it fresh or frozen by mail order, or canned in some Hispanic markets. WARNING: May cause contractions in pregnant women.","corn smut, cuitlacoche, huitlacoche Italian brown mushroom, maize mushroom, maizteca mushroom, Mexican truffle",Ustilago maydis,"['morels', 'squash blossoms']"
220,iceberg lettuce,"This is prized for its crispness and longevity in the refrigerator, but it's a bit short on flavor and nutrients.","cabbage lettuce, crisphead lettuce, head lettuce",Lactuca sativa,"['romaine lettuce', 'leaf lettuce']"
221,Indian bitter melon,"This is fairly bitter. Choose melons that are bright green. They turn tough and yellow as they age. You can eat the peels and seeds, or scrape out the seeds to reduce the bitterness.","balsam pear, bitter apple, bitter melon, bitter squash, Indian bitter gourd, karela",Momordica charantia,['bitter melon']
222,Indian eggplant,,baby eggplant,Solanum melongena,['Japanese eggplant']
223,infused garlic oil,,,,"['garlic', 'vegetable oil']"
224,Italian eggplant,"These are smaller than American eggplants, but they're otherwise very similar.",,Solanum melongena,['American eggplant']
225,Italian flat bean,"These green or yellow beans are like ordinary green beans, but they're flatter.   Select small, brightly colored beans that snap when you break them in half.","helda beans, Romano bean, runner bean",Phaseolus vulgaris,['green bean']
226,jalapeno pepper ,"These popular chilis have a good amount of heat and rich flavor. Green jalapenos are best in the late summer, while red jalapenos appear in the fall. Canned jalapenos aren't as fiery as fresh. When dried and smoked, this pepper is called a chipotle.",jalapeño Pepper,"Capsicum annuum, jalapeño","['cuaresmeno - fresh', 'Fresno pepper', 'guero pepper', 'melegueta pepper', 'Serrano pepper  ', 'yellow wax pepper ', 'cayenne pepper - fresh']"
227,jam leaf,,,,[]
228,jambu,Jambu is a low growing herb. The leaves are commonly eaten as a vegetable in Brazil. Jambu has a strong but pleasant taste that enhances salads and stews. It has a mild anesthetic affect that can cause numbness in the mouth.,"electric daisy, paracress",Acmella oleracea,[]
229,Japanese chili,"These small red chilis are hot, and similar to the chile de arbol. Before using them, soak them in warm water for a few minutes.",chile japones,,['chile de árbol dried']
230,Japanese cucumber,"These are just like English cucumbers, only with bumps. Like English cucumbers, they don't have to be peeled or seeded.",,,['English cucumber']
231,Japanese eggplant,"Like other Asian eggplants, Japanese eggplants have thin skins, and a sweet, delicate flavor.","nasu, nasubi",Solanum melongena,"['Chinese eggplant', 'Italian eggplant']"
232,japanese yam,Don't confuse this with yamaimo.,"Japanese sweet potato, kotobuki, satsuma imo",Ipomoea batatas,['Okinawan purple potato']
233,Jerusalem artichoke,"These look like small, knobby potatoes, but they have a crisp texture and an interesting earthy flavor. You can eat them raw, stir-fry them, or bake them like potatoes. It's best not to peel them, but you'll want to scrub off the dirt. If you slice them, dunk them immediately in acidulated water to keep them from discoloring.","earth apple, girasole, sunchoke, sunroot, topinambour",Helianthus tuberosus,"['artichoke hearts', 'potato', 'water chestnut', 'jicama']"
234,jicama,"This tan-skinned tuber has a mild, nondescript flavor, but a nice crunchy texture. It's a good, cheap substitute for water chestnuts in stir-fries. Since it doesn't discolor, it's also a great vegetable to serve raw on a crudité platter. Peel it before using.","ahipa, Chinese potato (this name also is used for arrow root), Chinese turnip (this name also is used for lo bok), jícama, Mexican potato, Mexican turnip, Mexican yam bean, saa got, yam bean",Pachyrhizus erosus,"['water chestnut', 'Jerusalem artichoke', 'apple', 'turnip', 'daikon']"
235,jute leaf,"These are tossed into stews in Africa, the Philippines, and Southeast Asia.","Jew mallow, krin-krin, rau day, saluyot, West Africa sorrel",,['spinach']
236,kabocha squash,"This orange-fleshed winter squash has a striated green rind. It's sweeter, drier, and less fibrous than other winter squash, and it tastes a bit like sweet potatoes.","Japanese pumpkin, Japanese squash, kabachi, nam gwa, sweet mama",Cucurbita maxima,"['butternut squash', 'acorn squash', 'turban squash']"
237,Kalamata olives,"You can find these popular Greek black olives in most large supermarkets. They're salty and have a rich, fruity flavor. These can be eaten out of hand, or used to make tapenades.",Calamata olive,Olea europaea,"['Gaeta olives', 'Amphissa olives']"
238,kale,"Kale is a kind of cabbage with dark green, wrinkled leaves.  It's prized more for its hardiness than its flavor or delicacy, but it continues to be popular in the South, where it's often cooked as a side dish.  Remove and discard the tough center stalks before cooking.  Varieties include curly kale, dinosaur kale = black cabbage = lacinato kale, and the popular Red Russian kale = ragged jack kale.","black cabbage, borecole, cow cabbage, curly kale, dinosaur kale, kail, lacinato kale, ragged jack kale, Red Russian kale",Brassica oleracea,"['collard greens', 'broccoli raab', 'Swiss chard', 'flowering kale', 'cabbage', 'napa cabbage', 'kohlrabi greens', 'mustard greens', 'spinach']"
239,Kashmiri red chili dried,This mild Kashmiri chili is used in Indian cooking to add flavor and color.,Kashmiri laal mirch,Capsicum annuum,['California chili ']
240,kelp powder,,,,"['Salt', 'monosodium glutamate']"
241,kershaw squash,Kershaw squash is an heirloom squash. It is mostly grown in the American south. Kershaw squash was cultivated by native Americans.,"cushaw squash, Tennessee sweet potato",Cucurbita argyrosperma,"['pumpkin', 'winter squash']"
242,Kirby cucumber,"This short, versatile cucumber is used for both slicing and pickling.  It's small, with bumpy yellow or green skin.  Like the English cucumber, it has a thin skin and inconspicuous seeds.",,,['English cucumber']
243,kittely,Kittely is a small round eggplant. It is used in soups and stews.,"NganNgan, small bitterball",Solanum macrocarpon,['Eggplants']
244,kiwano,"This melon has a gorgeous orange rind with spikes--poke a stick in it and you'd have a medieval mace for a Halloween costume. The yellow-green flesh has the consistency of jello, and tastes a bit like cucumbers.","African horned cucumber, African horned melon, cherie, English tomato, hedged gourd, horned melon, jelly melon, kiwano melon, melano, spiked melon",Cucumis metuliferus,"['cucumber', 'melons']"
245,kohlrabi,"A kohlrabi resembles a turnip, only it's sweeter and more delicately flavored. It's light green and sometimes sold with its edible greens attached. It can be eaten raw or cooked. Choose small ones, and peel before using.","cabbage turnip, German turnip, stem cabbage, turnip cabbage",Brassica oleracea,"['broccoli', 'celeriac', 'turnip', 'parsnip']"
246,kohlrabi greens, These can be cooked just like Swiss chard.  Remove the stems first if they're too thick.,,"Brassica oleracea, Gongylodes","['Swiss chard', 'collard greens', 'kale']"
247,konbu,"Like other sea vegetables, konbu is rich in minerals.  It's very popular in Japan, where it's used to flavor dashi, a soup stock.  Konbu is usually sold dried, in strips or sheets. Choose konbu that's very dark, almost black, and don't wipe off the white residue that often appears on the surface; it's very flavorful.","dasima, haidai, kelp, kombu, oarweed, sea cabbage, sea tangle, tangle",,['monosodium glutamate']
248,kontomire,"This African green is very hard to find fresh in the United States, and the canned version is terrible.",African spinach,,"['Swiss chard', 'spinach']"
249,Kura olives,This Middle Eastern cracked green olive is hard to find in the U.S.,,Olea europaea,['Nafplion green olives']
250,lamuyo pepper,"This hard-to-find sweet pepper is smaller and sweeter than its cousin, the bell pepper, with which it's interchangeable.","European sweet pepper, rouge royal",Capsicum annuum,['bell pepper']
251,laver,"This protein-rich seaweed is popular in Britain and Japan.  To rehydrate, soak it in water for about an hour, then add it to soups and salads.  Laver is sometimes called nori, but that name is more commonly used for the dark sheets that the Japanese use to wrap sushi, which are made from the same plant.","aonori, green laver, nori, parae, purple laver, purple seaweed, redware",,['sushi nori']
252,leaf lettuce,"With their crispness and mild flavor, these lettuces are great in salads and sandwiches.","bunching lettuce, cutting lettuce, lechuga, looseleaf lettuce, salad-bowl lettuce",Lactuca sativa,"['butterhead lettuce', 'romaine lettuce']"
253,leek," Leeks look like large green onions, and they have a more complex onion flavor. They're often cooked as a vegetable side dish, or used in soups. Be sure to wash them thoroughly before cooking as the leaves are notorious for collecting dirt.",,Allium ampeloprasum,"['yellow onion', 'asparagus', 'ramps']"
254,lemon cucumber,"This versatile cucumber is sweet and flavorful, and doesn't have much of the chemical that makes other cucumbers bitter and hard to digest. Though it's often served raw, it's also a good pickling cucumber.",,,"['garden cucumber', 'cucumber']"
255,lesser galangal,"This Indonesian rhizome looks a bit like ginger, only it's smaller and darker. It's hard to find in the U.S., but your best bet is to look in Asian markets. It's sold fresh, frozen, pickled, dried, or powdered. Used the dried or powdered versions only in a pinch.","kencur root, kentjur root, lesser galangale, zedoary",Alpinia officinarum,"['fingerroot', 'ginger root', 'galangal']"
256,lettuce,"These are mild salad greens that are always served fresh, either in salads or as garnishes. There are four basic categories: iceberg lettuce, with leaves that grow in a dense ""head,"" leaf lettuce, with loosely gathered leaves, butterhead lettuce, with tender leaves that form a soft head, and romaine lettuce, with closely packed leaves in an elongated head.  Select lettuce that has rich color and crisp, fresh-looking leaves.",,Lactuca sativa,"['spinach', 'spring salad mix', 'radicchio', 'cress', 'corn salad', 'arugula', 'Swiss chard']"
257,Ligurian olives,These small Italian olives are brine-cured.,"Liguria olive, Taggiasca olive",Olea europaea,['Nicoise olives']
258,lobster mushroom,These are actually white mushrooms that have been coated by a red fungus.,,Hypomyces lactifluorum,[]
259,lollo rosso,"This mild, tender lettuce has ruffled red edges.",,Lactuca sativa,['red-leaf lettuce']
260,long white potato,"These oblong potatoes have a medium starch content, and are valued for their versatility.  They're good to keep in the pantry as an all-purpose potato.","California long whites, white rose",Solanum tuberosum,[]
261,lotus root,"Slices of the lotus root have a beautiful pattern. The fresh version is available sporadically; if not, the canned version is almost as good. Rinse and drain before using. Look for it in Asian markets.","lotus, quangdong, tenno",Nelumbo nucifera,"['water chestnut', 'Jerusalem artichoke', 'jicama']"
262,Lucque olives,These green olives are brine-cured.,,Olea europaea,"['Picholine olives', 'Cerignola olives']"
263,Lugano olives,These are salty Italian/Swiss brownish-black olives.,,Olea europaea,[]
264,maitake mushroom,"This Japanese mushroom is reputed to have numerous health benefits.  It also has a nice, earthy flavor.","hen-of-the-woods mushroom, kumotake mushroom, ram's head mushroom, sheep's head mushroom",Grifola frondosa,['oyster mushroom']
265,Malabar spinach,"This is cooked much like spinach, but it's a bit slimy like okra.  It occasionally shows up in Asian markets","alogbati, Basella alba, Ceylon spinach, kontomire, mong toi, saan choy, slippery vegetable, Vietnamese spinach, vine spinach",Basella alba,"['spinach', 'okra']"
266,malanga,"Like taro and cassava, malanga is used in tropical countries in much the same way that potatoes are used in more temperate climates.","tanier, tannia, tannier, yautia",Xanthosoma sagittifolium,"['taro', 'sweet potato', 'potato', 'yam', 'plantain']"
267,manzana chili,This habanero relative is often used in salsas. It has black seeds. These are hot.,manzana chile,,"['habanero - fresh', 'Scotch bonnet chili']"
