,Name,Description,Also known as,Scientific name,Substitutions
0,ababai,"Ababais resemble small papayas, and can be cooked or grilled without losing their shape. They're hard to find outside of Chile, where they're grown.",,,"['papaya', 'mango']"
1,abiu,The round smooth yellow abiu fruit has a creamy texture and the sweet flavor of caramel or vanilla. It is native to the Amazon basin. The abiu fruit has a short shelf life.,"caimitt, luma",Pouteria caimito,['sapodilla']
2,acai berry,Acai berries are from the acai palm that is native to the Amazon Basin in Brazil. The small round dark purple fruit grows in clusters. Acai berries have a slight bitter taste. Long enjoyed in Brazil Acai berries have become increasing popular world wide over the last several decades. It is high in antioxidants.,"açaí, assai, huasai",Euterpe oleracea,"['blueberry', 'blackberry']"
3,acerola,"These are very rich in vitamin C, and somewhat acidic. You can eat them out of hand, but they're better suited for making preserves.","acerola cherry, Barbados cherry, Puerto Rican cherry, West Indian cherry, wild crepe myrtle",Malpighia emarginata,['cherry']
4,achacha,Achacha fruit is orange and has a sweet tart lemony taste. The fruit is oval and one to two inches in diameter. The achacha tree is native to the Amazon basin.,achachairú,Garcinia humilis,"['mangosteen', 'mango']"
5,ackee,"The pulp of this fruit looks and tastes like scrambled eggs when cooked, and Jamaicans like to serve it with salt cod.   Look for cans of it in Caribbean markets.  
Warning:  Only the yellow pulp on ripe ackees is edible.  Eating underripe ackees that haven't opened on their own, or eating the pink portion of ripe ackees, can cause vomiting and death.","achee, akee, vegetable brains, vegetable egg",,"['avocado', 'chickpea', 'almond']"
6,acorn squash,"This orange-fleshed winter squash is popular because of its small size--it can be cut in half and baked to make two generous servings. The rind, unfortunately, is quite hard and difficult to cut. To avoid injuring yourself, first slice off both the top and the bottom with a sharp knife, and use the stem end as a base for the more treacherous halving cut. Select acorn squash with as much green on the rind as possible, though most will have a single orange spot on one side.","Des Moines squash, pepper squash","Cucurbita pepo, turbinata","['buttercup squash', 'butternut squash', 'banana squash', 'turban squash', 'Hubbard squash', 'pumpkin', 'green papaya', 'golden nugget squash']"
7,Agrinion olives,"This is a large, green Greek olive with very tender flesh.",,Olea europaea,[]
8,ají panca chili - dried,"This reddish-brown dried chili is fruity, mild, and a little smoky. ",aji panca chile,Capsicum chinense,['pasilla chili']
9,ajwa dates,"These dark skinned ajwa dates are grown around Medina, Saudi Arabia. They were said to have been a favorite of the prophet Mohammad.","ajwa al madina, kurma ajwa",Phoenix dactylifera,"['dates', 'raisins', 'dried fig']"
10,Aleppo olives,"This is a black, dry-cured Middle Eastern olive that's hard to find in the United States.",,Olea europaea,[]
11,Alphonso olives,"This large Chilean olive is cured in a wine or wine vinegar solution, which gives it a beautiful dark purple color and tart flavor. Its flesh is very tender and slightly bitter.",Alfonso olive,Olea europaea,"['Kalamata olives', 'Gaeta olives']"
12,ambrosia apple,"Crisp and juicy, this is a great apple for snacking.",,Malus domestica,"['honeycrisp apples', 'Fuji apple', 'Pink Lady apple']"
13,ambrosia melon,"This looks and tastes like a cantaloupe, but the flesh is a brighter orange.",,"Cucumis melo, ambrosia",['cantaloupe']
14,American eggplant,"This is the familiar large, dark purple, pear-shaped variety. Choose small or medium-sized eggplants (these have fewer bitter seeds) with healthy-looking green stems that are firm to the touch, but not too hard. Avoid mushy ones. Store them in the refrigerator.",globe eggplant,Solanum melongena,"['Italian eggplant', 'Japanese eggplant']"
15,Amphissa olives,These are dark purple Greek olives that are hard to find in the U.S. They're great for snacking.,"Amfisa olive, Amfissa olive",Olea europaea,"['Kalamata olives', 'Gaeta olives']"
16,Anaheim chili,"These large, mild chiles are perfect for chiles rellenos. Mexican cooks also like to dice or purée them, and then add them to sauces, soups, and casseroles. They have a tough skin, but it peels off easily if you first char the chiles over a flame and then steam them in a paper bag for several minutes. Anaheims are available year-round, but they're best in the summer. You can occasionally find red Anaheims, which are riper and slightly hotter. When dried, this pepper is called a chile Colorado.","Anaheim chile, Anaheim chili pepper, Anaheim chilli, California green chili, california red chili (when mature and red), chile colorado (when mature and red), chile verde (CHEE-lay VER-day), long green pepper",,"['New Mexico green chili', 'poblano pepper ', 'green chile canned']"
17,ancho chili,"These mild, dried poblano peppers have a sweet, fruity flavor and are a staple in Mexican cuisine. They're brownish-black and wrinkled, and commonly used in adobos, moles, salsas, and various sauces.","ancho chile, ancho chino, chile color, chile colorado, dried poblano, pasilla chile (incorrectly), pasilla rojo",Capsicum annuum,"['mulato chili ', 'pasilla chili', 'poblano pepper ', 'California chili ', 'New Mexico red chili']"
18,angled loofa,"A native of Pakistan, this mild vegetable has a slightly bitter edge that pairs well with sweet and acidic ingredients in stir-fry dishes. You can also eat it raw, or dry it to make a loofa sponge.You can leave the peel on, but some people find the flavor off-putting. Remove any large seeds if you wish to cut the bitterness.","angled loofah, angled luffa, Chinese loofah, Chinese okra, dish cloth gourd, luffa angled gourd, luffa gourd, ribbed loofah, ridge gourd, ridged gourd, silk gourd, silky gourd, sinkwa towelsponge, sponge gourd, vegetable gourd",,"['zucchini', 'cucumber']"
19,Anjou pear,"These economical pears aren't as tasty as some of the other varieties, but they're still good for both eating and cooking. The peel stays light green even when the pear is ripe.","Beurré d'Anjou, d'Anjou pear","Pyrus communis, D'Anjou","['Asian pear', 'Bartlett pear']"
20,apple butter,"Apple butter isn't made from real butter. Instead, it's made by cooking apples until the sugar in them caramelizes, turning the sauce a rich brown color. It's used as a spread, and also as a fat-free substitute in many baking recipes.","black butter, Irish black butter",Malus domestica,"['apple', 'applesauce']"
21,apple cider,"Apple juice and apple cider are very similar, except that all of the apple pulp is filtered out of the juice, while some remains in the cider.",,Malus domestica,['apple juice']
22,apple green eggplant,"These eggplant resemble green apples, and are mild and sweet. You don't need to peel them.","applegreen eggplant, green apple eggplant",Solanum melongena,[]
23,apple jelly,"You can use this like any other jelly, but it's often used as a glaze when roasting pork.",,Malus domestica,"['black currant jelly', 'grape jelly', 'apple juice']"
24,apple juice,"Apple juice and apple cider are very similar, except that all of the apple pulp is filtered out of the juice, while some remains in the cider.",,Malus domestica,['apple cider']
25,applesauce,"Applesauce is a purée made from cooked apples. It's often flavored with sugar, lemon juice, and spices like cinnamon and allspice. It's often served as an accompaniment to pork, sausages, and potato pancakes. It can also be used as a fat substitute in baking.",apple sauce,Malus domestica,"['apple butter', 'pumpkin purée', 'plum purée']"
26,apricot,"Like other stone fruit, apricots are sweetest--and most prone to bruising--when they're allowed to ripen on the tree.  But unless you can pick your own, you'll probably have to make do with the slightly underripe, more durable apricots sold in markets.  Allow them to soften at room temperature for a few days before eating them.  They're best in the summer.",,Prunus armeniaca,"['aprium', 'pluot', 'peach', 'nectarine']"
27,apricot jam,,,Prunus armeniaca,"['peach jam', 'plum purée']"
28,aprium,"This is an apricot/plum cross, with apricot dominating.","plumcots, pluots",Prunus,"['pluot', 'apricot', 'plum']"
29,Arauco olives,These are large green Spanish olives flavored with rosemary.,,Olea europaea,['Manzanilla olives']
30,Arbequina olives,"These are tiny green Spanish olives with a mild, smoky flavor. They're hard to find in the U.S.",,Olea europaea,['Manzanilla olives']
31,Arkansas Black apple,This apple is renown for its long shelf life. It's good for making sauce and baking.,,Malus domestica,[]
32,Armenian cucumber,,"snake cucumber, snake melon, This is hard to find, but one of the best-regarded slicing cucumbers.  It's crisp, thin-skinned, and mild-flavored, and it has soft seeds.  Like the English cucumber, it doesn't need to be peeled or seeded.  It's not good for pickling., uri",,['English cucumber']
33,asam keping,,"asam gelugor, tamarind slice",,"['tamarind paste', 'tamarind', 'dark brown sugar']"
34,Asian eggplants,"Include Japanese eggplants and Chinese eggplants, have thinner skins and a more delicate flavor than American eggplants, and not as many of the seeds that tend to make eggplants bitter. They're usually more slender than American eggplants, but they vary in size and shape. They range in color from lavender to pink, green, and white.","Chinese eggplants, Japanese eggplants, Oriental eggplants",Solanum melongena,"['Eggplants', 'Japanese eggplant', 'Chinese eggplant', 'zucchini']"
35,Asian pear,"Asian pears are crunchy, juicy, and very fragrant. Growers produce over twenty different varieties in an assortment of sizes and colors. They're often served raw, but they can also be cooked, though they never become as soft as cooked pears.","apple pear, Chinese pear, Japanese pear, nashi, nashi pear, Oriental pear, salad pear, sand pear",Pyrus pyrifolia,"['Bosc pear', 'apple', 'quince']"
36,Atalanta olives,This is a muddy-green Greek olive with soft flesh.,,Olea europaea,['royal olives']
37,atemoya,This cherimoya-sweetsop cross has sweet custard-like pulp. Look for it in specialty produce markets during the fall,,,"['cherimoya', 'sweetsop', 'mango']"
38,autumn royal grapes,These are large dark purple sweet seedless grapes.,,Vitis vinifera,"['flame seedless grapes', 'red globe grapes']"
39,baby kiwifruit,You can eat this tiny kiwifruit hybrid skin and all.,,"Actinidia deliciosa, Hayward",['grapes']
40,bacon avocado,"This sweet, smooth-skinned variety shows up in the middle of winter.  It's not as flavorful as other avocados.",,Persea americana,"['avocado', 'chayote', 'fresh peas', 'asparagus', 'broccoli', 'artichoke hearts']"
41,bacuri,Bacuri fruit have thick yellow skins and are about the size of large apple. The bacuri fruit is both sweet and a little sour and is made into condiments and drinks.,"bacurizeiro, maniballi",Platonia insignis,[]
42,Baldwin apple,"This is a fairly sweet, all-purpose apple, but it's hard to find.",,Malus domestica,[]
43,banana,"Most of the bananas you and I have eaten in our lifetimes are the yellow Cavendish bananas. The burro banana = chunkey = chunky is shorter than the Cavendish, and has an interesting lemony flavor. The manzano banana is smaller yet and a bit drier, but it fits nicely into lunch boxes. The red banana has a purple peel and is best used for baking. The plantain is larger than other banana varieties, and is usually fried, baked, or mashed before eating. Yellow bananas with a few dark spots are ripe and ready to eat, while green ones will ripen at room temperature in just a few days. Refrigerating ripe bananas will keep them from getting softy and mushy, though the peels will darken.","burro banana, Cavendish bananas, chunkey, chunky, red banana","Musa acuminata, cavendish","['plantain', 'mango']"
44,banana pepper ,"These sweet, mild peppers with a fruity flavor are easily confused with hotter yellow wax peppers. Sample before using.","banana chile, banana chili pepper, banana wax pepper, sweet banana pepper",Capsicum annuum,"['bell pepper', 'yellow wax pepper ']"
45,banana squash,"This variety is so large that grocers usually cut into smaller chunks before putting it out.  It's tasty, but its biggest virtue is the beautiful golden color of its flesh.",,Cucurbita maxima,"['butternut squash', 'buttercup squash', 'acorn squash', 'Hubbard squash', 'pumpkin']"
46,barhi dates (fresh),These yellow barhi dates can be peeled and eaten fresh or dried.,,Phoenix dactylifera,['dates (fresh)']
47,Bartlett pear,These are very juicy and great for eating out of hand.  They turn yellow when ripe.,"Williams pear, Williams' bon chrétien","Pyrus communis, Williams","['Asian pear', 'Anjou pear', 'quince', 'Comice pear']"
48,bayberry juice,,,,[]
49,bell pepper,"Red and yellow peppers are riper, more flavorful, and pricier than the more common green ones. You can occasionally find bell peppers in other colors as well, like brown, white, pink, orange, and purple.Bell peppers are the perfect size for hollowing out and stuffing, or you can slice them into strips for snacking or dipping.","capsicum, sweet pepper",Capsicum annuum,"['Holland bell pepper', 'cubanelle', 'poblano pepper ', 'Anaheim chili', 'pimento']"
50,bergamot orange,"This is a small acidic orange, used for its peel. The flesh is too bitter and sour to be eaten raw. Don't confuse it with the bergamot herb. ",,Citrus bergamia,['lime']
51,bilberry,"This small, tart berry is the European counterpart to the American blueberry. Bilberries are usually made into preserves.","blaeberry, whinberry, whortleberry",Vaccinium myrtillus,"['juneberry', 'blueberry', 'huckleberry', 'cranberry', 'currant']"
52,bilimbi,,,,['star fruit']
53,bitter melon,This bitter vegetable is believed to have medicinal properties and is widely used throughout Asia.,"ampalaya, balsam pear, bitter apple, bitter cucumber, bitter gourd, bitter squash, Chinese bitter melon, foo gwa, karela",Momordica charantia,['winter melon']
54,bitter orange juice,,"bigarade orange juice, Seville orange juice, sour orange juice",,"['lime', 'orange', 'orange juice']"
55,black currant,"These are too tart to eat out of hand, but they're often used to make syrups, preserves, and the liqueur cassis.  Frozen are a good substitute for fresh.",cassis,Ribes nigrum,"['elderberry', 'blueberry', 'red currant', 'gooseberry']"
56,black currant jelly,Black currant jelly is sweeter than more common red currant jelly.,,Ribes,"['muscadine jelly', 'apple jelly', 'grape jelly']"
57,black olives,"These are olives that have been allowed to ripen on the tree. American recipes that call for black olives are probably referring to the Mission olive. Other varieties of black olives are the Aleppo, Alphonso, Amphissa, black Cerignola, Gaeta, black Greek, Kalamata, Ligurian, Lugano, Moroccan dry-cured, Niçoise, Nyons, Ponentine, and Royal.",ripe olives,Olea europaea,['green olives']
58,black sapote,This fruit has an olive-green rind and tastes like a papaya that's been sprinkled with cocoa.,chocolate pudding fruit,Diospyros nigra,[]
59,blackberry,"These would be excellent berries were it not for their rather large seeds.   They're still great for eating out of hand, but cooks often strain out the seeds when making pies and preserves.  Select berries that are free of mold, and as black as possible.  They arrive in markets in the summer.",bramble,,"['loganberry', 'boysenberry', 'mulberry', 'raspberry', 'youngberry', 'olallieberry', 'dewberry', 'red currant']"
60,blood orange,These red-fleshed oranges are more popular in Europe than in the United States. Look for them in the winter and spring.,"pigmented orange, raspberry orange",Citrus sinensis,"['orange', 'mandarin orange']"
61,blueberry,"Blueberries are small and sturdy, so they're perfect for tossing into cakes, muffins, cereal bowls, and fruit salads. Like other berries, they also make good preserves and tarts. Select firm, dark berries that have a whitish bloom on them. Keep them refrigerated and wash them just before you eat them.You can find fresh blueberries in the summer, but frozen blueberries are available year-round and work well in many recipes. Frozen berries get a little mushy after they're defrosted, but they'll work well in many recipes. Canned blueberries also work in pies and baked goods, but drain off the liquid and rinse them first.",,Vaccinium sect. Cyanococcus,"['huckleberry', 'juneberry', 'red currant', 'raisins', 'dates', 'banana']"
62,blueberry jam,,,Vaccinium sect. Cyanococcus,"['raspberry preserves', 'gooseberry preserves']"
63,Bosc pear,"This firm and crunchy pear is the best choice for cooking, because it holds its shape nicely. Bosc pears can also be eaten out of hand.","Beurre Bosc, Kaiser",Pyrus communis,['Asian pear']
64,boysenberry,"A boysenberry is a cross between a blackberry, a raspberry, and a loganberry. It's more fragile than a blackberry, but it doesn't have the blackberry's conspicuous seeds. Select boysenberries that are dark in color and free of mold.",,Rubus ursinus × R. idaeus,"['loganberry', 'blackberry', 'raspberry', 'olallieberry', 'dewberry', 'youngberry']"
65,Braeburn apple,This firm and juicy apple is good for eating out of hand or for baking.,,Malus domestica,"['honeycrisp apples', 'Golden Delicious apple']"
66,breadfruit,"This is the plant that the H.M.S. Bounty was carrying in the South Pacific when its crew mutinied. Captain Bligh's goal had been to transport the seedlings from Tahiti to the Caribbean, so that slaves there would have a ready source of starch and calories. Breadfruit is highly perishable, so fresh ones are hard to find outside the tropics. The canned version is a good substitute. A seeded version is called a breadnut.","pana de pepita, panapen",,"['jackfruit', 'plantain', 'potato']"
67,Buddha's hand citron,"This fragrant fruit has hardly any flesh, but the peel can be candied","Buddha's fingers citron, Buddha's hand, fingered citron","Citrus medica, sarcodactylis","['citron', 'lemon']"
68,bull's horn pepper,"This Italian heirloom pepper is shaped like a bull's horn, and many cooks think it's a lot more flavorful than an ordinary bell pepper.","Corno Di Toro Pepper, red bull's horn pepper",Capsicum annuum,['bell pepper']
69,buttercup squash,"With sweet and creamy orange flesh, the buttercup is one of the more highly regarded winter squashes.  The biggest shortcoming is that it tends to be a bit dry.  Choose specimens that are heavy for their size.",,Cucurbita maxima,"['butternut squash', 'acorn squash', 'Hubbard squash', 'delicata squash', 'kabocha squash', 'pumpkin', 'green papaya']"
70,butternut squash,"This variety is very popular because it's so easy to use.  It's small enough to serve a normal family without leftovers, and the rind is thin enough to peel off with a vegetable peeler.  As an added bonus, the flavor is sweet, moist, and pleasantly nutty.",,Cucurbita moschata,"['buttercup squash', 'acorn squash', 'calabaza', 'delicata squash', 'kabocha squash', 'Hubbard squash', 'green papaya']"
71,cachucha pepper,"These small sweet peppers come in different colors and looks like squished bell peppers. They're popular in the Caribbean, where they're often stuffed and roasted.","aji cachucha, aji dulce, Ajícito, rocatillo",Capsicum chinense,['bell pepper']
72,calabaza,"These are popular in Hispanic countries and throughout the Caribbean. They're large, so markets often cut them up before selling them.","abóbora, ahuyama, crapaudback, Cuban squash, giraumon, green pumpkin, Jamaican pumpkin, toadback, West Indian pumpkin, zapallo",Cucurbita moschata,"['butternut squash', 'buttercup squash', 'Hubbard squash', 'acorn squash']"
73,calamondin,,"calamondin orange, China orange, Panama orange, Philippine lemon, Philippine lime",Citrus microcarp,"['kumquat', 'kalamansi']"
74,calamondin juice,,,,"['kalamansi juice', 'key lime juice']"
75,California chili ,"These are dried Anaheim chiles, and very mild.",California chile,Capsicum annuum,"['New Mexico red chili', 'Anaheim chili']"
76,California sugar pear,"This small pear is the same size as a Seckel pear, but it's not as juicy and sweet.",,Pyrus communis,[]
77,Cameo apple,"This firm, mildly tart apple is quite versatile. Use Cameos in pies, applesauce, salads, or just eat them out of hand.",,Malus domestica,['red delicious apple']
78,Canary melon,"These tend to vary in quality, so unless you're good at selecting melons, stick with more idiot-proof varieties like the honeydew or cantaloupe. Canaries should, at a minimum, have bright yellow rinds. They're in season in the fall.",Juan Canary melon,Cucumis melo,"['honeydew melon', 'cantaloupe']"
79,candied angelica,These are used to make decorative flower stems on cakes.,,,['marzipan']
80,candied apricot,,"abricot glacé, glace apricot, glacéed apricot",,[]
81,candied chestnuts,"A French specialty, these are whole chestnuts that are candied in a sugar syrup. They're used to make various desserts.",marrons glacés,Castanea,['chestnut cream']
82,candied citron peel,,,,['sugar']
83,candied citrus peel,,,,"['grapefruit', 'orange', 'water', 'water']"
84,candied flowers,,,,['sugar']
85,candied fruit,,"glace fruits, glacé fruits, glah-SAY",,['dried apricot']
86,candied ginger,"Candied ginger is ginger that is stored in a sugary syrup, but the name is also sometimes used for crystallized ginger, which is ginger that's been cooked in syrup, then dried out and rolled in sugar. The two are often used interchangeably.",,,['ginger jam']
87,candied grapefruit peel,,,,['grapefruit']
88,candied lemon peel,,,,['water']
89,candied orange peel,,,,['sugar']
90,candied pineapple,,,,[]
91,canistel,"The canistel fruit is orange/yellow, oval and 2 to 3 inches long. It is sweet with the texture of a hard boiled egg.","cupcake fruit, eggfruit, lamut Khamen, laulu, sawo mentega, yellow sapote, zapote amarillo",Pouteria Campechiana,"['sapote', 'abiu', 'mamey sapote', 'mango', 'sapodilla']"
92,cantaloupe,"These are popular because they're easy to select and very sweet.  Ripe cantaloupes have dull yellow backgrounds with raised netting.  Avoid those with protruding stems, or tears in the rind at the stem end--it's a tell-tale sign that the melon was picked too soon.  When ripe melons are picked, the stem falls off easily, leaving a small, clean depression.  After checking the stem end, flip the melon over and check the blossom end.  It should be fragrant and yield a bit when pressed.   Cantaloupes are cheapest in the summer.","muskmelon, netted melon, nutmeg melon, rockmelon","Cucumis melo, cantalupensis","['Cranshaw melon', 'honeydew melon', 'Persian melon']"
93,Cape gooseberry,"Like its relative the tomatillo, the Cape gooseberry is covered with a papery husk.  The fruit inside looks a bit like a yellow cherry, and tastes like a sweet tomato.  You can eat Cape gooseberries whole, minus the husk, or use them to make very tasty preserves.  They're hard to find in the United States; your best bet is a specialty produce market in the spring.","alkekengi, Chinese lantern, golden berry, golden gooseberry, golden husk, ground cherry, husk tomato, physalis, poha, strawberry tomato",Physalis peruviana,"['tomatillo', 'gooseberry', 'cherry tomato']"
94,Capulin cherry,,"Capuli, Capulin, Panama berry, tropic cherry, tropical cherry",Muntingia calabura,['sweet cherry']
95,carissa,"You won't find these in markets, but these tart plums are great for making preserves.",natal plum,,"['cranberry', 'raspberry']"
96,carosello,"There are many varieties of carosellos. They are often referred to as cucumber melons. They are a sweet version of a cucumber. Some varieties are; carosello tondo massafra, fakous, pupuneddhra bianca, carosello leccese and painted serpent.",cucumber melon,Cucumis melo,[]
97,carrot juice,,,Daucus carota,[]
98,casaba melon,"These aren't as flavorful as other melons, but they have a fairly long shelf life. Since they have thick rinds, it's useless to smell them as a test for ripeness. Look instead at the color (it should be bright yellow), and then check to see if the blossom end yields to gentle pressure.",,Cucumis melo,"['Santa Claus melon', 'Cranshaw melon', 'Spanish melon', 'Sharlyn melon', 'cantaloupe']"
99,cascabel pepper - dried,These are nicknamed rattle chiles because the seeds rattle when you shake them. They're a rich brown color and moderately hot.,"bola chile, cascabel chile, chile bola, rattle chile",Capsicum annuum,"['guajillo chili ', 'pequin pepper dried', 'tepin dried', 'cayenne pepper dried']"
100,cashew apple,"This Brazilian fruit looks like a squishy apple with an odd-looking stem growing out of it. According to botanists, though, the grayish ""stem"" is actually the fruit, and it encloses the kidney-shaped cashew nut that we're familiar with. The cashew apple is the yellowish-orange part that's attached to the fruit. This fruit is juicy but somewhat astringent due to a high concentration of tannin. Be careful of the grayish substance that encloses the nut. It contains toxic oils.","caju, cajueiro, cashew fruit, marañon, merey",Anacardium occidentale,['mango']
101,Catarina chili dried,"This medium-hot Mexican chili is used to make tamales, marinades, stews and soups. It's got a fruity flavor with just a hint of tobacco.","Catarina pepper, chile cora, ladybug chile",Capsicum annuum,[]
